-- phpMyAdmin SQL Dump
-- version 5.2.1
-- https://www.phpmyadmin.net/
--
-- Host: 127.0.0.1
-- Generation Time: May 26, 2024 at 08:02 PM
-- Server version: 10.4.32-MariaDB
-- PHP Version: 8.2.12

SET SQL_MODE = "NO_AUTO_VALUE_ON_ZERO";
START TRANSACTION;
SET time_zone = "+00:00";


/*!40101 SET @OLD_CHARACTER_SET_CLIENT=@@CHARACTER_SET_CLIENT */;
/*!40101 SET @OLD_CHARACTER_SET_RESULTS=@@CHARACTER_SET_RESULTS */;
/*!40101 SET @OLD_COLLATION_CONNECTION=@@COLLATION_CONNECTION */;
/*!40101 SET NAMES utf8mb4 */;

--
-- Database: `automatedtrading`
--

-- --------------------------------------------------------

--
-- Table structure for table `asset`
--

CREATE TABLE `asset` (
  `id` int(11) NOT NULL,
  `name` varchar(45) DEFAULT NULL
) ENGINE=InnoDB DEFAULT CHARSET=utf8mb4 COLLATE=utf8mb4_general_ci;

-- --------------------------------------------------------

--
-- Table structure for table `assetstrategy-futureuse`
--

CREATE TABLE `assetstrategy-futureuse` (
  `AssetID` int(11) NOT NULL,
  `Asset` varchar(255) NOT NULL,
  `UserID` int(11) NOT NULL,
  `StopLossPercent` float DEFAULT NULL,
  `TakeProfitPercent` float DEFAULT NULL,
  `PositionSizePercent` float DEFAULT NULL,
  `AdjTriggerPrice` float DEFAULT NULL,
  `AdjStopPrice` float DEFAULT NULL,
  `AdjStopLimitPrice` float DEFAULT NULL,
  `AdjTrailingAmount` float DEFAULT NULL
) ENGINE=InnoDB DEFAULT CHARSET=utf8mb4 COLLATE=utf8mb4_general_ci;

-- --------------------------------------------------------

--
-- Table structure for table `channel`
--

CREATE TABLE `channel` (
  `id` int(40) NOT NULL,
  `name` varchar(45) DEFAULT NULL
) ENGINE=InnoDB DEFAULT CHARSET=utf8mb4 COLLATE=utf8mb4_general_ci;

-- --------------------------------------------------------

--
-- Stand-in structure for view `futures_view`
-- (See below for the actual view)
--
CREATE TABLE `futures_view` (
`id` int(11) unsigned
,`CopyTrade` bit(1)
,`ProviderName` varchar(255)
,`ChannelName` varchar(255)
,`AssetType` varchar(20)
,`InstrumentType` varchar(10)
,`PositionSizePercent` float
,`EntryOffsetPercent` float
,`StopLossPercent` float
,`TP1Percent` float
,`TrailPercent` float
,`BreakevenPercent` float
,`positionAmount` float
,`EntryOffsetAmount` float
,`StopLossAmount` decimal(10,0)
,`TP1Amount` decimal(10,0)
,`TrailAmount` decimal(10,2)
,`BreakEvenAmountPerContract` decimal(10,0)
,`CreationTime` timestamp
,`EntryStrategy` varchar(40)
,`ExitStrategy` varchar(40)
,`PremiumMin` float
,`PremiumMax` float
,`MktCapMin` float
,`MktCapMax` float
,`Size1` float
,`Provider_id` varchar(40)
,`Channel_id` varchar(40)
,`user_id` int(11)
);

-- --------------------------------------------------------

--
-- Table structure for table `provider`
--

CREATE TABLE `provider` (
  `id` int(40) UNSIGNED NOT NULL,
  `name` varchar(45) DEFAULT NULL
) ENGINE=InnoDB DEFAULT CHARSET=utf8mb4 COLLATE=utf8mb4_general_ci;

-- --------------------------------------------------------

--
-- Table structure for table `signals`
--

CREATE TABLE `signals` (
  `id` int(11) NOT NULL,
  `CreationTime` varchar(30) NOT NULL,
  `ExecutedTime` varchar(30) DEFAULT NULL,
  `AssetType` varchar(20) NOT NULL,
  `InstrumentType` varchar(10) NOT NULL,
  `Action` int(1) NOT NULL,
  `Side` varchar(20) NOT NULL,
  `Instrument` varchar(30) NOT NULL,
  `Price` decimal(10,2) NOT NULL,
  `MarketPrice` decimal(10,2) NOT NULL,
  `FillPrice` double NOT NULL,
  `Status` varchar(256) DEFAULT NULL,
  `ProviderName` varchar(255) DEFAULT NULL,
  `ChannelName` varchar(255) DEFAULT NULL,
  `Quantity` int(11) NOT NULL,
  `TimeStamp` timestamp NOT NULL DEFAULT current_timestamp(),
  `Channel_id` varchar(40) NOT NULL,
  `Provider_id` varchar(40) NOT NULL,
  `asset_id` varchar(40) NOT NULL,
  `ExecutedQuantity` double NOT NULL,
  `user_id` int(11) NOT NULL,
  `webhook_URL` varchar(255) NOT NULL,
  `Userkey` varchar(40) DEFAULT NULL,
  `Reason` varchar(100) DEFAULT NULL
) ENGINE=InnoDB DEFAULT CHARSET=utf8mb4 COLLATE=utf8mb4_general_ci;

--
-- Dumping data for table `signals`
--

INSERT INTO `signals` (`id`, `CreationTime`, `ExecutedTime`, `AssetType`, `InstrumentType`, `Action`, `Side`, `Instrument`, `Price`, `MarketPrice`, `FillPrice`, `Status`, `ProviderName`, `ChannelName`, `Quantity`, `TimeStamp`, `Channel_id`, `Provider_id`, `asset_id`, `ExecutedQuantity`, `user_id`, `webhook_URL`, `Userkey`, `Reason`) VALUES
(4, '12/22/2023 09:40:44', NULL, 'Futures', 'ES', 1, 'open', 'ES MAR24', 4774.00, 0.00, 0, 'timed out', 'farazmatin', 'signalchannel', 0, '2023-12-22 14:40:44', '1100830612383879188', '403285053259513858', '', 0, 0, '', NULL, NULL),
(5, '12/22/2023 09:45:43', NULL, 'Futures', 'ES', -1, 'open', 'ES MAR24', 4818.00, 0.00, 0, 'timed out', 'shadowtrader', 'ðŸ’«ï¸±futures-alerts', 0, '2023-12-22 14:45:43', '1102240963109331085', '602859673053429776', '', 0, 0, '', NULL, NULL),
(6, '12/22/2023 09:45:43', NULL, 'Futures', 'ES', -1, 'open', 'ES MAR24', 4818.00, 0.00, 0, 'timed out', 'shadowtrader', 'ðŸ’«ï¸±futures-alerts', 0, '2023-12-22 14:45:43', '1102240963109331085', '602859673053429776', '', 0, 0, '', NULL, NULL),
(7, '12/22/2023 09:45:43', NULL, 'Futures', 'ES', -1, 'open', 'ES MAR24', 4818.00, 0.00, 0, 'timed out', 'shadowtrader', 'ðŸ’«ï¸±futures-alerts', 0, '2023-12-22 14:45:43', '1102240963109331085', '602859673053429776', '', 0, 0, '', NULL, NULL),
(8, '12/22/2023 09:45:43', NULL, 'Futures', 'ES', -1, 'open', 'ES MAR24', 4818.00, 0.00, 0, 'timed out', 'shadowtrader', 'ðŸ’«ï¸±futures-alerts', 0, '2023-12-22 14:45:43', '1102240963109331085', '602859673053429776', '', 0, 0, '', NULL, NULL),
(9, '12/22/2023 09:51:24', NULL, 'Futures', 'ES', 1, 'close', 'ES MAR24', 4821.00, 0.00, 0, 'timed out', 'shadowtrader', 'ðŸ’«ï¸±futures-alerts', 0, '2023-12-22 14:51:24', '1102240963109331085', '602859673053429776', '', 0, 0, '', NULL, NULL),
(10, '12/22/2023 09:45:43', NULL, 'Futures', 'ES', 1, 'open', 'ES MAR24', 4818.00, 0.00, 0, 'Enter Long Filled', 'shadowtrader', 'ðŸ’«ï¸±futures-alerts', 0, '2023-12-22 14:45:43', '1102240963109331085', '602859673053429776', '', 0, 0, '', NULL, NULL),
(11, '12/22/2023 10:39:37', NULL, 'Futures', 'NQ', 1, 'open', 'NQ MAR24', 17015.50, 0.00, 0, 'timed out', 'trav_trades', 'ðŸ’«ï¸±futures-alerts', 3, '2023-12-22 15:39:37', '1102240963109331085', '399929170928467968', '', 0, 0, '', NULL, NULL),
(12, '12/22/2023 10:49:58', NULL, 'Futures', 'NQ', -1, 'close', 'NQ MAR24', 17020.25, 0.00, 0, 'timed out', 'trav_trades', 'ðŸ’«ï¸±futures-alerts', 3, '2023-12-22 15:49:58', '1102240963109331085', '399929170928467968', '', 0, 0, '', NULL, NULL),
(13, '12/22/2023 11:03:57', NULL, 'Futures', 'ES', 1, 'open', 'ES MAR24', 4808.25, 0.00, 0, 'Enter Long Filled', 'cedar_trades', 'ðŸ’«ï¸±futures-alerts', 0, '2023-12-22 16:03:57', '1102240963109331085', '706687912225538109', '', 0, 0, '', NULL, NULL),
(14, '12/22/2023 11:06:37', NULL, 'Futures', 'ES', 1, 'open', 'ES MAR24', 4804.75, 0.00, 0, 'skipped - long position exists', 'cedar_trades', 'ðŸ’«ï¸±futures-alerts', 2, '2023-12-22 16:06:37', '1102240963109331085', '706687912225538109', '', 0, 0, '', NULL, NULL),
(15, '12/22/2023 11:08:00', NULL, 'Futures', 'ES', 1, 'open', 'ES MAR24', 4806.00, 0.00, 0, 'skipped - long position exists', 'shadowtrader', 'ðŸ’«ï¸±futures-alerts', 0, '2023-12-22 16:08:00', '1102240963109331085', '602859673053429776', '', 0, 0, '', NULL, NULL),
(16, '12/22/2023 11:13:35', NULL, 'Futures', 'ES', -1, 'close', 'ES MAR24', 4810.50, 0.00, 0, 'Exit Long', 'cedar_trades', 'ðŸ’«ï¸±futures-alerts', 3, '2023-12-22 16:13:35', '1102240963109331085', '706687912225538109', '', 0, 0, '', NULL, NULL),
(17, '12/22/2023 11:23:14', NULL, 'Futures', 'ES', -1, 'close', 'ES MAR24', 4812.00, 0.00, 0, 'skipped - no long position to close', 'shadowtrader', 'ðŸ’«ï¸±futures-alerts', 0, '2023-12-22 16:23:14', '1102240963109331085', '602859673053429776', '', 0, 0, '', NULL, NULL),
(18, '12/22/2023 15:04:10', NULL, 'Futures', 'ES', 1, 'open', 'ES MAR24', 4814.00, 0.00, 0, 'skipped - price out of range', 'farazmatin', 'signalchannel', 0, '2023-12-22 20:04:10', '1100830612383879188', '403285053259513858', '', 0, 0, '', NULL, NULL),
(19, '12/22/2023 15:05:27', NULL, 'Futures', 'ES', 1, 'open', 'ES MAR24', 4807.00, 0.00, 0, 'Enter Long Filled', 'farazmatin', 'signalchannel', 0, '2023-12-22 20:05:27', '1100830612383879188', '403285053259513858', '', 0, 0, '', NULL, NULL),
(20, '04/27/2024 09:51:29', NULL, 'Futures', 'NQ', 1, 'open', 'NQ MAR24', 17689.00, 0.00, 0, 'skipped - Not supported', 'farazmatin', 'signalchannel', 2, '2024-04-27 13:51:29', '1100830612383879188', '403285053259513858', '', 0, 0, '', NULL, NULL),
(22, '04/27/2024 09:51:29', NULL, 'Futures', 'ES', 1, 'open', 'ES MAR24', 4950.00, 0.00, 0, 'skipped - Not supported', 'farazmatin', 'signalchannel', 3, '2024-04-27 13:51:29', '1100830612383879188', '403285053259513858', '', 0, 0, '', NULL, NULL),
(23, '04/27/2024 10:02:32', NULL, 'Futures', 'NQ', 1, 'open', 'NQ MAR24', 17689.00, 0.00, 0, 'skipped - Not supported', 'farazmatin', 'signalchannel', 2, '2024-04-27 14:02:32', '1100830612383879188', '403285053259513858', '', 0, 0, '', NULL, NULL),
(24, '04/27/2024 10:02:32', NULL, 'Futures', 'ES', 1, 'open', 'ES MAR24', 4950.00, 0.00, 0, 'skipped - Not supported', 'farazmatin', 'signalchannel', 3, '2024-04-27 14:02:32', '1100830612383879188', '403285053259513858', '', 0, 0, '', NULL, NULL),
(25, '04/27/2024 10:55:53', NULL, 'Futures', 'NQ', 1, 'open', 'NQ MAR24', 17689.00, 0.00, 0, 'skipped - Not supported', 'farazmatin', 'signalchannel', 2, '2024-04-27 14:55:53', '1100830612383879188', '403285053259513858', '', 0, 0, '', NULL, NULL),
(26, '04/27/2024 10:55:53', NULL, 'Futures', 'ES', 1, 'open', 'ES MAR24', 4950.00, 0.00, 0, 'skipped - Not supported', 'farazmatin', 'signalchannel', 3, '2024-04-27 14:55:53', '1100830612383879188', '403285053259513858', '', 0, 0, '', NULL, NULL),
(27, '05/04/2024 17:20:18', NULL, 'Futures', 'ES', 1, 'open', 'ES MAR24', 4950.00, 0.00, 0, 'skipped - Not supported', 'farazmatin', 'signalchannel', 3, '2024-05-04 21:20:19', '1100830612383879188', '403285053259513858', '', 0, 0, '', NULL, NULL),
(28, '05/04/2024 17:20:18', NULL, 'Futures', 'ES', 1, 'open', 'ES MAR24', 4950.00, 0.00, 0, 'skipped - Not supported', 'farazmatin', 'signalchannel', 3, '2024-05-04 21:20:19', '1100830612383879188', '403285053259513858', '', 0, 0, '', NULL, NULL),
(29, '05/04/2024 17:20:18', NULL, 'Futures', 'ES', 1, 'open', 'ES MAR24', 4950.00, 0.00, 0, 'skipped - Not supported', 'farazmatin', 'signalchannel', 3, '2024-05-04 21:20:19', '1100830612383879188', '403285053259513858', '', 0, 0, '', NULL, NULL),
(30, '05/04/2024 17:20:18', NULL, 'Futures', 'ES', 1, 'open', 'ES MAR24', 4950.00, 0.00, 0, 'skipped - Not supported', 'farazmatin', 'signalchannel', 3, '2024-05-04 21:20:19', '1100830612383879188', '403285053259513858', '', 0, 0, '', NULL, NULL),
(31, '05/04/2024 17:20:18', NULL, 'Futures', 'ES', 1, 'open', 'ES MAR24', 5021.00, 0.00, 0, 'skipped - Not supported', 'farazmatin', 'signalchannel', 3, '2024-05-04 21:20:19', '1100830612383879188', '403285053259513858', '', 0, 0, '', NULL, NULL),
(32, '05/04/2024 17:20:18', NULL, 'Futures', 'ES', 1, 'open', 'ES MAR24', 5021.00, 0.00, 0, 'skipped - Not supported', 'farazmatin', 'signalchannel', 3, '2024-05-04 21:20:19', '1100830612383879188', '403285053259513858', '', 0, 0, '', NULL, NULL),
(33, '05/04/2024 17:24:01', NULL, 'Futures', 'NQ', 1, 'open', 'NQ MAR24', 17689.00, 0.00, 0, 'skipped - Not supported', 'farazmatin', 'signalchannel', 2, '2024-05-04 21:24:01', '1100830612383879188', '403285053259513858', '', 0, 0, '', NULL, NULL),
(34, '05/04/2024 17:24:01', NULL, 'Futures', 'ES', 1, 'open', 'ES MAR24', 4950.00, 0.00, 0, 'skipped - Not supported', 'farazmatin', 'signalchannel', 3, '2024-05-04 21:24:01', '1100830612383879188', '403285053259513858', '', 0, 0, '', NULL, NULL),
(35, '05/04/2024 17:24:01', NULL, 'Futures', 'ES', 1, 'open', 'ES MAR24', 4950.00, 0.00, 0, 'skipped - Not supported', 'farazmatin', 'signalchannel', 3, '2024-05-04 21:24:01', '1100830612383879188', '403285053259513858', '', 0, 0, '', NULL, NULL),
(36, '05/04/2024 17:24:01', NULL, 'Futures', 'ES', 1, 'open', 'ES MAR24', 4950.00, 0.00, 0, 'skipped - Not supported', 'farazmatin', 'signalchannel', 3, '2024-05-04 21:24:01', '1100830612383879188', '403285053259513858', '', 0, 0, '', NULL, NULL),
(37, '05/04/2024 17:24:01', NULL, 'Futures', 'ES', 1, 'open', 'ES MAR24', 4950.00, 0.00, 0, 'skipped - Not supported', 'farazmatin', 'signalchannel', 3, '2024-05-04 21:24:01', '1100830612383879188', '403285053259513858', '', 0, 0, '', NULL, NULL),
(38, '05/04/2024 17:24:01', NULL, 'Futures', 'ES', 1, 'open', 'ES MAR24', 4950.00, 0.00, 0, 'skipped - Not supported', 'farazmatin', 'signalchannel', 3, '2024-05-04 21:24:01', '1100830612383879188', '403285053259513858', '', 0, 0, '', NULL, NULL),
(39, '05/04/2024 17:24:01', NULL, 'Futures', 'ES', 1, 'open', 'ES MAR24', 4950.00, 0.00, 0, 'skipped - Not supported', 'farazmatin', 'signalchannel', 3, '2024-05-04 21:24:01', '1100830612383879188', '403285053259513858', '', 0, 0, '', NULL, NULL),
(40, '05/04/2024 17:24:01', NULL, 'Futures', 'ES', 1, 'open', 'ES MAR24', 5021.00, 0.00, 0, 'skipped - Not supported', 'farazmatin', 'signalchannel', 3, '2024-05-04 21:24:01', '1100830612383879188', '403285053259513858', '', 0, 0, '', NULL, NULL),
(41, '05/04/2024 17:24:01', NULL, 'Futures', 'ES', 1, 'open', 'ES MAR24', 5021.00, 0.00, 0, 'skipped - Not supported', 'farazmatin', 'signalchannel', 3, '2024-05-04 21:24:01', '1100830612383879188', '403285053259513858', '', 0, 0, '', NULL, NULL),
(42, '05/04/2024 17:24:01', NULL, 'Futures', 'ES', 1, 'open', 'ES MAR24', 4950.00, 0.00, 0, 'skipped - Not supported', 'farazmatin', 'signalchannel', 3, '2024-05-04 21:24:01', '1100830612383879188', '403285053259513858', '', 0, 0, '', NULL, NULL),
(43, '05/04/2024 17:24:01', NULL, 'Futures', 'ES', 1, 'open', 'ES MAR24', 4950.00, 0.00, 0, 'skipped - Not supported', 'farazmatin', 'signalchannel', 3, '2024-05-04 21:24:01', '1100830612383879188', '403285053259513858', '', 0, 0, '', NULL, NULL),
(44, '05/04/2024 17:24:01', NULL, 'Futures', 'ES', 1, 'open', 'ES MAR24', 4950.00, 0.00, 0, 'skipped - Not supported', 'farazmatin', 'signalchannel', 3, '2024-05-04 21:24:01', '1100830612383879188', '403285053259513858', '', 0, 0, '', NULL, NULL),
(45, '05/04/2024 17:24:01', NULL, 'Futures', 'ES', 1, 'open', 'ES MAR24', 4950.00, 0.00, 0, 'skipped - Not supported', 'farazmatin', 'signalchannel', 3, '2024-05-04 21:24:01', '1100830612383879188', '403285053259513858', '', 0, 0, '', NULL, NULL),
(46, '05/04/2024 17:24:01', NULL, 'Futures', 'ES', 1, 'open', 'ES MAR24', 5021.00, 0.00, 0, 'skipped - Not supported', 'farazmatin', 'signalchannel', 3, '2024-05-04 21:24:01', '1100830612383879188', '403285053259513858', '', 0, 0, '', NULL, NULL),
(47, '05/04/2024 17:24:01', NULL, 'Futures', 'ES', 1, 'open', 'ES MAR24', 5021.00, 0.00, 0, 'skipped - Not supported', 'farazmatin', 'signalchannel', 3, '2024-05-04 21:24:01', '1100830612383879188', '403285053259513858', '', 0, 0, '', NULL, NULL),
(48, '05/04/2024 17:24:01', NULL, 'Futures', 'ES', 1, 'open', 'ES MAR24', 4950.00, 0.00, 0, 'skipped - Not supported', 'farazmatin', 'signalchannel', 3, '2024-05-04 21:24:01', '1100830612383879188', '403285053259513858', '', 0, 0, '', NULL, NULL),
(49, '05/04/2024 17:24:01', NULL, 'Futures', 'ES', 1, 'open', 'ES MAR24', 4950.00, 0.00, 0, 'skipped - Not supported', 'farazmatin', 'signalchannel', 3, '2024-05-04 21:24:01', '1100830612383879188', '403285053259513858', '', 0, 0, '', NULL, NULL),
(50, '05/04/2024 17:24:01', NULL, 'Futures', 'ES', 1, 'open', 'ES MAR24', 4950.00, 0.00, 0, 'skipped - Not supported', 'farazmatin', 'signalchannel', 3, '2024-05-04 21:24:01', '1100830612383879188', '403285053259513858', '', 0, 0, '', NULL, NULL),
(51, '05/04/2024 17:24:01', NULL, 'Futures', 'ES', 1, 'open', 'ES MAR24', 4950.00, 0.00, 0, 'skipped - Not supported', 'farazmatin', 'signalchannel', 3, '2024-05-04 21:24:01', '1100830612383879188', '403285053259513858', '', 0, 0, '', NULL, NULL),
(52, '05/04/2024 17:24:01', NULL, 'Futures', 'ES', 1, 'open', 'ES MAR24', 5021.00, 0.00, 0, 'skipped - Not supported', 'farazmatin', 'signalchannel', 3, '2024-05-04 21:24:01', '1100830612383879188', '403285053259513858', '', 0, 0, '', NULL, NULL),
(53, '05/07/2024 17:17:32', NULL, 'Futures', 'ES', 1, 'open', 'ES MAR24', 4888.00, 0.00, 0, 'skipped - Not supported', 'farazmatin', 'signalchannel', 3, '2024-05-07 21:17:32', '1100830612383879188', '403285053259513858', '', 0, 0, '', NULL, NULL),
(54, '05/07/2024 17:17:32', NULL, 'Futures', 'ES', 1, 'open', 'ES MAR24', 4888.00, 0.00, 0, 'skipped - Not supported', 'farazmatin', 'signalchannel', 3, '2024-05-07 21:17:32', '1100830612383879188', '403285053259513858', '', 0, 0, '', NULL, NULL),
(55, '05/07/2024 17:17:32', NULL, 'Futures', 'ES', 1, 'open', 'ES MAR24', 4888.00, 0.00, 0, 'skipped - Not supported', 'farazmatin', 'signalchannel', 3, '2024-05-07 21:17:32', '1100830612383879188', '403285053259513858', '', 0, 0, '', NULL, NULL),
(56, '05/07/2024 17:17:32', NULL, 'Futures', 'ES', 1, 'open', 'ES MAR24', 4888.00, 0.00, 0, 'skipped - Not supported', 'farazmatin', 'signalchannel', 3, '2024-05-07 21:17:32', '1100830612383879188', '403285053259513858', '', 0, 0, '', NULL, NULL),
(57, '05/07/2024 17:17:32', NULL, 'Futures', 'ES', 1, 'open', 'ES MAR24', 4888.00, 0.00, 0, 'skipped - Not supported', 'farazmatin', 'signalchannel', 3, '2024-05-07 21:17:32', '1100830612383879188', '403285053259513858', '', 0, 0, '', NULL, NULL),
(58, '05/07/2024 18:09:02', NULL, 'Futures', 'ES', 1, 'open', 'ES MAR24', 5208.00, 0.00, 0, 'skipped - Not supported', 'farazmatin', 'signalchannel', 3, '2024-05-07 22:09:02', '1100830612383879188', '403285053259513858', '', 0, 0, '', NULL, NULL),
(59, '05/07/2024 18:13:47', NULL, 'Futures', 'ES', 1, 'open', 'ES JUN24', 5209.00, 5166.00, 0, 'skipped - price out of range', 'farazmatin', 'signalchannel', 3, '2024-05-07 22:13:47', '1100830612383879188', '403285053259513858', '', 0, 0, '', NULL, NULL),
(60, '05/07/2024 18:15:34', NULL, 'Futures', 'ES', 1, 'open', 'ES JUN24', 5210.00, 5210.00, 0, 'skipped - price out of range', 'farazmatin', 'signalchannel', 3, '2024-05-07 22:15:35', '1100830612383879188', '403285053259513858', '', 0, 0, '', NULL, NULL),
(61, '05/07/2024 18:20:38', '05/07/2024 18:20:37', 'Futures', 'ES', 1, 'open', 'ES JUN24', 5210.00, 5211.00, 5211.25, 'Enter Long Filled', 'farazmatin', 'signalchannel', 3, '2024-05-07 22:20:38', '1100830612383879188', '403285053259513858', '', 3, 0, '', NULL, NULL),
(62, '05/07/2024 18:23:01', NULL, 'Futures', 'ES', -1, 'close', 'ES JUN24', 5210.00, 5211.00, 0, 'Exit Long', 'farazmatin', 'signalchannel', 3, '2024-05-07 22:23:01', '1100830612383879188', '403285053259513858', '', 0, 0, '', NULL, NULL),
(63, '05/07/2024 18:25:10', '05/07/2024 18:25:13', 'Futures', 'ES', 1, 'open', 'ES JUN24', 5211.00, 5211.25, 5211.25, 'Enter Long Filled', 'farazmatin', 'signalchannel', 3, '2024-05-07 22:25:10', '1100830612383879188', '403285053259513858', '', 3, 0, '', NULL, NULL),
(64, '05/07/2024 18:29:23', NULL, 'Futures', 'ES', -1, 'close', 'ES JUN24', 5210.00, 5212.00, 0, 'Exit Long', 'farazmatin', 'signalchannel', 3, '2024-05-07 22:29:23', '1100830612383879188', '403285053259513858', '', 0, 0, '', NULL, NULL),
(65, '05/07/2024 18:29:44', '05/07/2024 18:29:45', 'Futures', 'ES', 1, 'open', 'ES JUN24', 5212.00, 5211.75, 5212, 'Enter Long Filled', 'farazmatin', 'signalchannel', 3, '2024-05-07 22:29:44', '1100830612383879188', '403285053259513858', '', 3, 0, '', NULL, NULL),
(66, '05/07/2024 18:35:52', NULL, 'Futures', 'NQ', 1, 'open', 'NQ JUN24', 5212.00, 18184.25, 0, 'skipped - price out of range', 'farazmatin', 'signalchannel', 3, '2024-05-07 22:35:52', '1100830612383879188', '403285053259513858', '', 0, 0, '', NULL, NULL),
(67, '05/07/2024 18:37:20', NULL, 'Futures', 'NQ', 1, 'open', 'NQ JUN24', 18200.00, 18184.25, 0, 'skipped - price out of range', 'farazmatin', 'signalchannel', 3, '2024-05-07 22:37:20', '1100830612383879188', '403285053259513858', '', 0, 0, '', NULL, NULL),
(68, '05/07/2024 18:37:49', '05/07/2024 18:37:49', 'Futures', 'NQ', 1, 'open', 'NQ JUN24', 18200.00, 18199.50, 18200.25, 'Enter Long Filled', 'farazmatin', 'signalchannel', 3, '2024-05-07 22:37:49', '1100830612383879188', '403285053259513858', '', 1, 0, '', NULL, NULL),
(69, '05/07/2024 18:38:21', NULL, 'Futures', 'NQ', -1, 'close', 'NQ JUN24', 18200.00, 0.00, 0, 'expired - time', 'farazmatin', 'signalchannel', 3, '2024-05-07 22:38:21', '1100830612383879188', '403285053259513858', '', 0, 0, '', NULL, NULL),
(70, '05/07/2024 22:10:15', '05/07/2024 22:10:31', 'Futures', 'NQ', 1, 'open', 'NQ JUN24', 18205.00, 18204.75, 18204.75, 'Enter Long Filled', 'farazmatin', 'signalchannel', 3, '2024-05-08 02:10:15', '1100830612383879188', '403285053259513858', '', 1, 0, '', NULL, NULL),
(71, '05/07/2024 22:13:56', NULL, 'Futures', 'NQ', -1, 'close', 'NQ JUN24', 18200.00, 18206.00, 0, 'Exit Long', 'farazmatin', 'signalchannel', 3, '2024-05-08 02:13:56', '1100830612383879188', '403285053259513858', '', 0, 0, '', NULL, NULL),
(72, '05/07/2024 22:57:20', '05/07/2024 22:57:23', 'Futures', 'ES', 1, 'open', 'ES JUN24', 5212.50, 5212.50, 5212.5, 'Enter Long Filled', 'farazmatin', 'signalchannel', 3, '2024-05-08 02:57:21', '1100830612383879188', '403285053259513858', '', 3, 0, '', NULL, NULL),
(73, '05/07/2024 22:57:52', NULL, 'Futures', 'ES', -1, 'close', 'ES JUN24', 5212.50, 5212.25, 0, 'Exit Long', 'farazmatin', 'signalchannel', 3, '2024-05-08 02:57:52', '1100830612383879188', '403285053259513858', '', 0, 0, '', NULL, NULL),
(74, '05/07/2024 22:59:00', '05/07/2024 22:59:16', 'Futures', 'ES', -1, 'open', 'ES JUN24', 5212.50, 5212.25, 5212.25, 'Enter Short Filled', 'farazmatin', 'signalchannel', 3, '2024-05-08 02:59:00', '1100830612383879188', '403285053259513858', '', 3, 0, '', NULL, NULL),
(75, '05/07/2024 23:00:17', NULL, 'Futures', 'ES', 1, 'close', 'ES JUN24', 5212.50, 5212.50, 0, 'Exit Short', 'farazmatin', 'signalchannel', 3, '2024-05-08 03:00:17', '1100830612383879188', '403285053259513858', '', 0, 0, '', NULL, NULL),
(76, '05/08/2024 01:10:25', '05/08/2024 01:10:26', 'Futures', 'ES', 1, 'open', 'ES JUN24', 5211.00, 5211.25, 5211.5, 'Enter Long Filled', 'farazmatin', 'signalchannel', 3, '2024-05-08 05:10:25', '1100830612383879188', '403285053259513858', '', 3, 0, '', NULL, NULL),
(77, '05/08/2024 01:10:42', NULL, 'Futures', 'ES', -1, 'close', 'ES JUN24', 5212.50, 5211.50, 0, 'Exit Long', 'farazmatin', 'signalchannel', 3, '2024-05-08 05:10:42', '1100830612383879188', '403285053259513858', '', 0, 0, '', NULL, NULL),
(78, '05/08/2024 01:11:59', '05/08/2024 01:12:05', 'Futures', 'ES', 1, 'open', 'ES JUN24', 5211.00, 5211.25, 5211.5, 'Enter Long Filled', 'farazmatin', 'signalchannel', 3, '2024-05-08 05:11:59', '1100830612383879188', '403285053259513858', '', 3, 0, '', NULL, NULL),
(79, '05/08/2024 01:12:08', NULL, 'Futures', 'ES', -1, 'close', 'ES JUN24', 5212.50, 5211.25, 0, 'Exit Long', 'farazmatin', 'signalchannel', 3, '2024-05-08 05:12:08', '1100830612383879188', '403285053259513858', '', 0, 0, '', NULL, NULL),
(80, '05/08/2024 01:15:27', NULL, 'Futures', 'ES', 1, 'open', 'ES JUN24', 5211.00, 5164.75, 0, 'skipped - price out of range', 'farazmatin', 'signalchannel', 3, '2024-05-08 05:15:27', '1100830612383879188', '403285053259513858', '', 0, 0, '', NULL, NULL),
(81, '05/08/2024 01:15:38', NULL, 'Futures', 'ES', -1, 'close', 'ES JUN24', 5212.50, 5166.00, 0, 'skipped - no long position to close', 'farazmatin', 'signalchannel', 3, '2024-05-08 05:15:38', '1100830612383879188', '403285053259513858', '', 0, 0, '', NULL, NULL),
(82, '05/08/2024 01:17:53', NULL, 'Futures', 'ES', 1, 'open', 'ES JUN24', 5211.00, 0.00, 0, 'expired - time', 'farazmatin', 'signalchannel', 3, '2024-05-08 05:17:53', '1100830612383879188', '403285053259513858', '', 0, 0, '', NULL, NULL),
(83, '05/08/2024 01:27:55', '05/08/2024 01:27:55', 'Futures', 'ES', 1, 'open', 'ES JUN24', 5210.00, 5210.75, 5211, 'Enter Long Filled', 'farazmatin', 'signalchannel', 3, '2024-05-08 05:27:55', '1100830612383879188', '403285053259513858', '', 3, 0, '', NULL, NULL),
(84, '05/08/2024 01:37:00', NULL, 'Futures', 'ES', 1, 'open', 'ES JUN24', 5171.00, 5108.25, 0, 'skipped - price out of range', 'farazmatin', 'signalchannel', 3, '2024-05-08 05:37:00', '1100830612383879188', '403285053259513858', '', 0, 0, '', NULL, NULL),
(85, '05/08/2024 01:37:36', NULL, 'Futures', 'ES', 1, 'open', 'ES JUN24', 5171.00, 5108.25, 0, 'skipped - price out of range', 'farazmatin', 'signalchannel', 3, '2024-05-08 05:37:36', '1100830612383879188', '403285053259513858', '', 0, 0, '', NULL, NULL),
(86, '05/08/2024 01:38:52', NULL, 'Futures', 'ES', -1, 'close', 'ES JUN24', 5212.50, 5172.25, 0, 'skipped - no long position to close', 'farazmatin', 'signalchannel', 3, '2024-05-08 05:38:52', '1100830612383879188', '403285053259513858', '', 0, 0, '', NULL, NULL),
(87, '05/08/2024 01:41:04', NULL, 'Futures', 'ES', 1, 'open', 'ES JUN24', 5171.00, 5108.25, 0, 'skipped - price out of range', 'farazmatin', 'signalchannel', 3, '2024-05-08 05:41:04', '1100830612383879188', '403285053259513858', '', 0, 0, '', NULL, NULL),
(88, '05/08/2024 01:42:38', NULL, 'Futures', 'ES', 1, 'open', 'ES JUN24', 5172.00, 0.00, 0, 'expired - time', 'farazmatin', 'signalchannel', 3, '2024-05-08 05:42:38', '1100830612383879188', '403285053259513858', '', 0, 0, '', NULL, NULL),
(89, '05/08/2024 13:26:10', '05/08/2024 13:26:10', 'Futures', 'ES', 1, 'open', 'ES JUN24', 5203.00, 5203.25, 5203.25, 'Enter Long Filled', 'farazmatin', 'signalchannel', 3, '2024-05-08 17:26:10', '1100830612383879188', '403285053259513858', '', 3, 0, '', NULL, NULL),
(90, '05/08/2024 13:26:25', '05/08/2024 13:26:25', 'Futures', 'NQ', 1, 'open', 'NQ JUN24', 18145.00, 18143.00, 18143, 'Enter Long Filled', 'farazmatin', 'signalchannel', 3, '2024-05-08 17:26:25', '1100830612383879188', '403285053259513858', '', 1, 0, '', NULL, NULL),
(91, '05/08/2024 13:38:37', '05/08/2024 13:38:37', 'Futures', 'ES', 1, 'open', 'ES JUN24', 5204.00, 5203.75, 5204, 'Enter Long Filled', 'farazmatin', 'signalchannel', 3, '2024-05-08 17:38:37', '1100830612383879188', '403285053259513858', '', 3, 0, '', NULL, NULL),
(92, '05/08/2024 13:38:53', '05/08/2024 13:38:53', 'Futures', 'NQ', 1, 'open', 'NQ JUN24', 18150.00, 18149.00, 18149.5, 'Enter Long Filled', 'farazmatin', 'signalchannel', 3, '2024-05-08 17:38:53', '1100830612383879188', '403285053259513858', '', 1, 0, '', NULL, NULL),
(93, '05/08/2024 13:43:51', '05/08/2024 13:43:50', 'Futures', 'NQ', 1, 'open', 'NQ JUN24', 18160.00, 18160.00, 18160, 'Enter Long Filled', 'farazmatin', 'signalchannel', 3, '2024-05-08 17:43:51', '1100830612383879188', '403285053259513858', '', 1, 0, '', NULL, NULL),
(94, '05/08/2024 13:43:57', '05/08/2024 13:43:56', 'Futures', 'ES', 1, 'open', 'ES JUN24', 5206.00, 5205.75, 5206, 'Enter Long Filled', 'farazmatin', 'signalchannel', 3, '2024-05-08 17:43:57', '1100830612383879188', '403285053259513858', '', 3, 0, '', NULL, NULL),
(95, '05/08/2024 13:47:54', '05/08/2024 13:47:55', 'Futures', 'ES', 1, 'open', 'ES JUN24', 5208.00, 5208.00, 5208, 'Enter Long Filled', 'farazmatin', 'signalchannel', 3, '2024-05-08 17:47:54', '1100830612383879188', '403285053259513858', '', 3, 0, '', NULL, NULL),
(96, '05/08/2024 13:48:01', '05/08/2024 13:48:01', 'Futures', 'NQ', 1, 'open', 'NQ JUN24', 18166.00, 18165.50, 18165.5, 'Enter Long Filled', 'farazmatin', 'signalchannel', 3, '2024-05-08 17:48:01', '1100830612383879188', '403285053259513858', '', 1, 0, '', NULL, NULL),
(97, '05/08/2024 13:48:41', '05/08/2024 13:48:40', 'Futures', 'NQ', -1, 'open', 'NQ JUN24', 18163.00, 18165.25, 18164.75, 'Enter Short Filled', 'farazmatin', 'signalchannel', 3, '2024-05-08 17:48:41', '1100830612383879188', '403285053259513858', '', 1, 0, '', NULL, NULL),
(98, '05/08/2024 13:50:57', '05/08/2024 13:50:56', 'Futures', 'NQ', -1, 'open', 'NQ JUN24', 18168.00, 18170.00, 18169.75, 'Enter Short Filled', 'farazmatin', 'signalchannel', 3, '2024-05-08 17:50:57', '1100830612383879188', '403285053259513858', '', 1, 0, '', NULL, NULL),
(99, '05/08/2024 14:08:23', '05/08/2024 14:08:22', 'Futures', 'NQ', -1, 'open', 'NQ JUN24', 18178.00, 18178.50, 18178.25, 'Enter Short Filled', 'farazmatin', 'signalchannel', 3, '2024-05-08 18:08:23', '1100830612383879188', '403285053259513858', '', 1, 0, '', NULL, NULL),
(100, '05/08/2024 14:08:38', '05/08/2024 14:08:40', 'Futures', 'ES', -1, 'open', 'ES JUN24', 5211.00, 5211.00, 5211, 'Enter Short Filled', 'farazmatin', 'signalchannel', 3, '2024-05-08 18:08:38', '1100830612383879188', '403285053259513858', '', 3, 0, '', NULL, NULL),
(101, '05/08/2024 14:11:10', '05/08/2024 14:11:10', 'Futures', 'NQ', -1, 'open', 'NQ JUN24', 18180.00, 18180.00, 18179.5, 'Enter Short Filled', 'farazmatin', 'signalchannel', 3, '2024-05-08 18:11:10', '1100830612383879188', '403285053259513858', '', 1, 0, '', NULL, NULL),
(102, '05/08/2024 14:11:16', '05/08/2024 14:11:15', 'Futures', 'ES', -1, 'open', 'ES JUN24', 5211.00, 5211.25, 5211.25, 'Enter Short Filled', 'farazmatin', 'signalchannel', 3, '2024-05-08 18:11:16', '1100830612383879188', '403285053259513858', '', 3, 0, '', NULL, NULL),
(103, '05/08/2024 14:16:09', '05/08/2024 14:16:09', 'Futures', 'NQ', -1, 'open', 'NQ JUN24', 18189.00, 18189.75, 18189.5, 'Enter Short Filled', 'farazmatin', 'signalchannel', 3, '2024-05-08 18:16:09', '1100830612383879188', '403285053259513858', '', 1, 0, '', NULL, NULL),
(104, '05/08/2024 14:16:16', '05/08/2024 14:16:18', 'Futures', 'ES', -1, 'open', 'ES JUN24', 5213.00, 5213.25, 5213, 'Enter Short Filled', 'farazmatin', 'signalchannel', 3, '2024-05-08 18:16:16', '1100830612383879188', '403285053259513858', '', 3, 0, '', NULL, NULL),
(105, '05/08/2024 15:02:47', NULL, 'Futures', 'ES', 1, 'open', 'ES JUN24', 5209.00, 0.00, 0, 'expired - time', 'cedar_trades', 'ðŸŸ¨-futures-alerts', 3, '2024-05-08 19:02:47', '829041100181995571', '706687912225538109', '', 0, 0, '', NULL, NULL),
(106, '05/08/2024 15:48:38', NULL, 'Futures', 'ES', -1, 'close', 'ES JUN24', 5216.00, 0.00, 0, 'expired - time', 'cedar_trades', 'ðŸŸ¨-futures-alerts', 3, '2024-05-08 19:48:38', '829041100181995571', '706687912225538109', '', 0, 0, '', NULL, NULL),
(107, '05/09/2024 10:22:25', NULL, 'Futures', 'ES', -1, 'open', 'ES JUN24', 5213.00, 5216.75, 0, 'skipped - price out of range', 'farazmatin', 'signalchannel', 3, '2024-05-09 14:22:25', '1100830612383879188', '403285053259513858', '', 0, 0, '', NULL, NULL),
(108, '05/09/2024 10:30:14', NULL, 'Futures', 'ES', 1, 'open', 'ES JUN24', 5218.00, 0.00, 0, 'expired - time', 'shadowtrader', 'ðŸŸ¨-futures-alerts', 1, '2024-05-09 14:30:14', '829041100181995571', '602859673053429776', '', 0, 0, '', NULL, NULL),
(109, '05/09/2024 10:31:48', NULL, 'Futures', 'ES', 1, 'open', 'ES JUN24', 5221.50, 0.00, 0, 'expired - time', 'ocean212', 'ðŸ’«ï¸±futures-alerts', 1, '2024-05-09 14:31:48', '1232475403407327303', '180421030605488128', '', 0, 0, '', NULL, NULL),
(110, '05/09/2024 10:37:04', NULL, 'Futures', 'ES', -1, 'open', 'ES JUN24', 5223.75, 0.00, 0, 'expired - time', 'dcruz', 'ðŸ’«ï¸±futures-alerts', 0, '2024-05-09 14:37:04', '1232475403407327303', '480583337661038602', '', 0, 0, '', NULL, NULL),
(111, '05/09/2024 10:38:43', NULL, 'Futures', 'ES', -1, 'close', 'ES JUN24', 5226.75, 0.00, 0, 'expired - time', 'ocean212', 'ðŸ’«ï¸±futures-alerts', 1, '2024-05-09 14:38:43', '1232475403407327303', '180421030605488128', '', 0, 0, '', NULL, NULL),
(112, '05/09/2024 10:38:46', NULL, 'Futures', 'ES', 1, 'close', 'ES JUN24', 5226.75, 0.00, 0, 'expired - time', 'dcruz', 'ðŸ’«ï¸±futures-alerts', 0, '2024-05-09 14:38:46', '1232475403407327303', '480583337661038602', '', 0, 0, '', NULL, NULL),
(113, '05/09/2024 10:39:08', NULL, 'Futures', 'ES', -1, 'close', 'ES JUN24', 5226.00, 0.00, 0, 'expired - time', 'shadowtrader', 'ðŸŸ¨-futures-alerts', 1, '2024-05-09 14:39:08', '829041100181995571', '602859673053429776', '', 0, 0, '', NULL, NULL),
(114, '05/09/2024 11:03:16', NULL, 'Futures', 'ES', -1, 'open', 'ES JUN24', 5231.50, 0.00, 0, 'expired - time', 'dcruz', 'ðŸ’«ï¸±futures-alerts', 0, '2024-05-09 15:03:16', '1232475403407327303', '480583337661038602', '', 0, 0, '', NULL, NULL),
(115, '05/09/2024 11:13:32', NULL, 'Futures', 'ES', 1, 'close', 'ES JUN24', 5228.50, 5229.50, 0, 'skipped - no short position to close', 'dcruz', 'ðŸ’«ï¸±futures-alerts', 0, '2024-05-09 15:13:32', '1232475403407327303', '480583337661038602', '', 0, 0, '', NULL, NULL),
(116, '05/09/2024 11:03:16', NULL, 'Futures', 'ES', -1, 'open', 'ES JUN24', 5231.50, 0.00, 0, 'expired - time', 'dcruz', 'ðŸ’«ï¸±futures-alerts', 0, '2024-05-09 15:03:16', '1232475403407327303', '480583337661038602', '', 0, 0, '', NULL, NULL),
(117, '05/09/2024 11:15:55', '05/09/2024 11:15:54', 'Futures', 'ES', -1, 'open', 'ES JUN24', 5231.00, 5231.50, 5231.25, 'Enter Short Filled', 'farazmatin', 'signalchannel', 3, '2024-05-09 15:15:55', '1100830612383879188', '403285053259513858', '', 3, 0, '', NULL, NULL),
(118, '05/09/2024 11:16:23', NULL, 'Futures', 'ES', 1, 'close', 'ES JUN24', 5231.00, 5230.50, 0, 'Exit Short Placed', 'farazmatin', 'signalchannel', 3, '2024-05-09 15:16:23', '1100830612383879188', '403285053259513858', '', 0, 0, '', NULL, NULL),
(119, '05/09/2024 11:03:16', NULL, 'Futures', 'ES', -1, 'open', 'ES JUN24', 5229.00, 0.00, 0, 'expired - time', 'dcruz', 'ðŸ’«ï¸±futures-alerts', 0, '2024-05-09 15:03:16', '1232475403407327303', '480583337661038602', '', 0, 0, '', NULL, NULL),
(121, '05/09/2024 11:20:16', NULL, 'Futures', 'ES', -1, 'open', 'ES JUN24', 5229.00, 5166.00, 0, 'skipped - price out of range', 'dcruz', 'ðŸ’«ï¸±futures-alerts', 0, '2024-05-09 15:03:16', '1232475403407327303', '480583337661038602', '', 0, 0, '', NULL, NULL),
(122, '05/09/2024 11:26:16', NULL, 'Futures', 'ES', -1, 'open', 'ES JUN24', 5229.00, 5229.25, 0, 'skipped - price out of range', 'dcruz', 'ðŸ’«ï¸±futures-alerts', 0, '2024-05-09 15:03:16', '1232475403407327303', '480583337661038602', '', 0, 0, '', NULL, NULL),
(123, '05/09/2024 11:40:45', NULL, 'Futures', 'NQ', -1, 'open', 'NQ JUN24', 18220.50, 0.00, 0, 'expired - time', 'trav_trades', 'ðŸ’«ï¸±futures-alerts', 3, '2024-05-09 15:40:45', '1232475403407327303', '399929170928467968', '', 0, 0, '', NULL, NULL),
(124, '05/09/2024 11:44:16', NULL, 'Futures', 'NQ', 1, 'close', 'NQ JUN24', 18210.50, 0.00, 0, 'expired - time', 'trav_trades', 'ðŸ’«ï¸±futures-alerts', 3, '2024-05-09 15:44:16', '1232475403407327303', '399929170928467968', '', 0, 0, '', NULL, NULL),
(125, '05/09/2024 11:58:51', NULL, 'Futures', 'ES', 1, 'open', 'ES JUN24', 5222.00, 5222.00, 0, 'skipped - price out of range', 'shadowtrader', 'ðŸŸ¨-futures-alerts', 1, '2024-05-09 15:58:51', '829041100181995571', '602859673053429776', '', 0, 0, '', NULL, NULL),
(126, '05/09/2024 11:59:16', NULL, 'Futures', 'NQ', 1, 'open', 'NQ JUN24', 18177.00, 0.00, 0, 'expired - time', 'trav_trades', 'ðŸ’«ï¸±futures-alerts', 3, '2024-05-09 15:44:16', '1232475403407327303', '399929170928467968', '', 0, 0, '', NULL, NULL),
(127, '05/09/2024 12:03:30', NULL, 'Futures', 'ES', 1, 'open', 'ES JUN24', 5222.25, 5223.75, 0, 'skipped - price out of range', 'dcruz', 'ðŸ’«ï¸±futures-alerts', 0, '2024-05-09 16:03:30', '1232475403407327303', '480583337661038602', '', 0, 0, '', NULL, NULL),
(128, '05/09/2024 12:08:30', '05/09/2024 12:07:35', 'Futures', 'ES', 1, 'open', 'ES JUN24', 5224.00, 5223.75, 5223.75, 'Enter Long Filled', 'dcruz', 'ðŸ’«ï¸±futures-alerts', 0, '2024-05-09 16:03:30', '1232475403407327303', '480583337661038602', '', 3, 0, '', NULL, NULL),
(129, '05/09/2024 12:15:04', NULL, 'Futures', 'ES', -1, 'close', 'ES JUN24', 5226.25, 5226.50, 0, 'Exit Long Placed', 'dcruz', 'ðŸ’«ï¸±futures-alerts', 0, '2024-05-09 16:15:04', '1232475403407327303', '480583337661038602', '', 0, 0, '', NULL, NULL),
(130, '05/09/2024 12:15:06', NULL, 'Futures', 'ES', -1, 'close', 'ES JUN24', 5226.00, 5226.50, 0, 'skipped - no long position to close', 'shadowtrader', 'ðŸŸ¨-futures-alerts', 1, '2024-05-09 16:15:06', '829041100181995571', '602859673053429776', '', 0, 0, '', NULL, NULL),
(131, '05/09/2024 12:39:43', NULL, 'Futures', 'ES', 1, 'open', 'ES JUN24', 5227.75, 5227.00, 0, 'skipped - invalid quantity', 'dcruz', 'ðŸ’«ï¸±futures-alerts', 0, '2024-05-09 16:39:43', '1232475403407327303', '480583337661038602', '', 0, 0, '', NULL, NULL),
(132, '05/09/2024 12:55:56', NULL, 'Futures', 'ES', -1, 'close', 'ES JUN24', 5230.75, 5231.25, 0, 'skipped - no long position to close', 'dcruz', 'ðŸ’«ï¸±futures-alerts', 0, '2024-05-09 16:55:56', '1232475403407327303', '480583337661038602', '', 0, 0, '', NULL, NULL),
(133, '05/09/2024 13:07:57', '05/09/2024 13:07:58', 'Futures', 'ES', 1, 'open', 'ES JUN24', 5233.50, 5233.50, 5233.5, 'Enter Long Filled', 'ocean212', 'ðŸ’«ï¸±futures-alerts', 1, '2024-05-09 17:07:57', '1232475403407327303', '180421030605488128', '', 1, 0, '', NULL, NULL),
(134, '05/09/2024 13:19:20', NULL, 'Futures', 'ES', -1, 'close', 'ES JUN24', 5229.50, 5230.00, 0, 'skipped - no long position to close', 'ocean212', 'ðŸ’«ï¸±futures-alerts', 1, '2024-05-09 17:19:20', '1232475403407327303', '180421030605488128', '', 0, 0, '', NULL, NULL),
(135, '05/09/2024 14:32:32', NULL, 'Futures', 'ES', -1, 'close', 'ES JUN24', 5228.00, 0.00, 0, 'expired - time', 'shadowtrader', 'ðŸŸ¨-futures-alerts', 1, '2024-05-09 18:32:32', '829041100181995571', '602859673053429776', '', 0, 0, '', NULL, NULL),
(136, '05/09/2024 14:40:52', NULL, 'Futures', 'ES', -1, 'open', 'ES JUN24', 5233.25, 0.00, 0, 'expired - time', 'dcruz', 'ðŸ’«ï¸±futures-alerts', 0, '2024-05-09 18:40:52', '1232475403407327303', '480583337661038602', '', 0, 0, '', NULL, NULL),
(137, '05/09/2024 14:46:15', NULL, 'Futures', 'ES', 1, 'open', 'ES JUN24', 5234.50, 0.00, 0, 'expired - time', 'ocean212', 'ðŸ’«ï¸±futures-alerts', 1, '2024-05-09 18:46:15', '1232475403407327303', '180421030605488128', '', 0, 0, '', NULL, NULL),
(138, '05/09/2024 14:51:57', NULL, 'Futures', 'ES', 1, 'close', 'ES JUN24', 5237.25, 0.00, 0, 'expired - time', 'dcruz', 'ðŸ’«ï¸±futures-alerts', 0, '2024-05-09 18:51:57', '1232475403407327303', '480583337661038602', '', 0, 0, '', NULL, NULL),
(139, '05/09/2024 14:55:09', NULL, 'Futures', 'NQ', 1, 'open', 'NQ JUN24', 18228.25, 0.00, 0, 'expired - time', 'trav_trades', 'ðŸ’«ï¸±futures-alerts', 3, '2024-05-09 18:55:09', '1232475403407327303', '399929170928467968', '', 0, 0, '', NULL, NULL),
(140, '05/09/2024 14:56:51', NULL, 'Futures', 'ES', -1, 'close', 'ES JUN24', 5237.75, 0.00, 0, 'expired - time', 'ocean212', 'ðŸ’«ï¸±futures-alerts', 1, '2024-05-09 18:56:51', '1232475403407327303', '180421030605488128', '', 0, 0, '', NULL, NULL),
(141, '05/09/2024 15:05:36', NULL, 'Futures', 'ES', 1, 'open', 'ES JUN24', 5236.00, 0.00, 0, 'expired - time', 'dcruz', 'ðŸ’«ï¸±futures-alerts', 0, '2024-05-09 19:05:36', '1232475403407327303', '480583337661038602', '', 0, 0, '', NULL, NULL),
(142, '05/09/2024 15:51:20', NULL, 'Futures', 'ES', -1, 'close', 'ES JUN24', 5239.00, 5238.25, 0, 'skipped - no long position to close', 'dcruz', 'ðŸ’«ï¸±futures-alerts', 0, '2024-05-09 19:51:20', '1232475403407327303', '480583337661038602', '', 0, 0, '', NULL, NULL),
(143, '05/09/2024 16:06:24', NULL, 'Futures', 'NQ', 1, 'open', 'NQ JUN24', 18217.50, 0.00, 0, 'expired - time', 'trav_trades', 'ðŸ’«ï¸±futures-alerts', 3, '2024-05-09 20:06:24', '1232475403407327303', '399929170928467968', '', 0, 0, '', NULL, NULL),
(144, '05/09/2024 16:09:07', NULL, 'Futures', 'NQ', -1, 'close', 'NQ JUN24', 18223.75, 0.00, 0, 'expired - time', 'trav_trades', 'ðŸ’«ï¸±futures-alerts', 3, '2024-05-09 20:09:07', '1232475403407327303', '399929170928467968', '', 0, 0, '', NULL, NULL),
(145, '05/09/2024 17:27:07', NULL, 'Futures', 'NQ', -1, 'close', 'NQ JUN24', 18220.00, 0.00, 0, 'expired - time', 'trav_trades', 'ðŸ’«ï¸±futures-alerts', 3, '2024-05-09 20:09:07', '1232475403407327303', '399929170928467968', '', 0, 0, '', NULL, NULL),
(146, '05/09/2024 17:32:07', NULL, 'Futures', 'NQ', -1, 'close', 'NQ JUN24', 18220.00, 0.00, 0, 'expired - time', 'trav_trades', 'ðŸ’«ï¸±futures-alerts', 3, '2024-05-09 20:09:07', '1232475403407327303', '399929170928467968', '', 0, 0, '', NULL, NULL),
(147, '05/20/2024 10:47:51', '05/20/2024 10:47:51', 'Futures', 'ES', 1, 'open', 'ES JUN24', 5345.00, 5345.50, 5345.75, 'Enter Long Filled', 'farazmatin', 'signalchannel', 3, '2024-05-20 14:47:51', '1100830612383879188', '403285053259513858', '', 3, 0, '', NULL, NULL),
(148, '05/20/2024 10:49:05', NULL, 'Futures', 'ES', -1, 'close', 'ES JUN24', 5345.00, 5346.25, 0, 'Exit Long Placed', 'farazmatin', 'signalchannel', 3, '2024-05-20 14:49:05', '1100830612383879188', '403285053259513858', '', 0, 0, '', NULL, NULL),
(149, '05/20/2024 12:17:27', '05/20/2024 12:17:28', 'Futures', 'ES', -1, 'open', 'ES JUN24', 5341.25, 5341.00, 5340.75, 'Enter Short Filled', 'dcruz', 'ðŸ’«ï¸±futures-alerts', 0, '2024-05-20 16:17:27', '1232475403407327303', '480583337661038602', '', 1, 0, '', NULL, NULL),
(151, '05/20/2024 13:34:05', NULL, 'Futures', 'ES', 1, 'open', 'ES JUN24', 5344.00, 5335.50, 0, 'skipped - price out of range', 'farazmatin', 'signalchannel', 3, '2024-05-20 17:34:05', '1100830612383879188', '403285053259513858', '', 0, 0, '', NULL, NULL),
(152, '05/20/2024 13:34:25', '05/20/2024 13:34:27', 'Futures', 'ES', 1, 'open', 'ES JUN24', 5336.00, 5336.00, 5336, 'Enter Long Filled', 'farazmatin', 'signalchannel', 3, '2024-05-20 17:34:25', '1100830612383879188', '403285053259513858', '', 3, 0, '', NULL, NULL),
(153, '05/20/2024 13:34:42', NULL, 'Futures', 'ES', -1, 'close', 'ES JUN24', 5345.00, 5336.75, 0, 'Exit Long Placed', 'farazmatin', 'signalchannel', 3, '2024-05-20 17:34:42', '1100830612383879188', '403285053259513858', '', 0, 0, '', NULL, NULL),
(154, '05/20/2024 12:17:27', '05/20/2024 13:46:28', 'Futures', 'ES', -1, 'open', 'ES JUN24', 5337.00, 5341.00, 5340.75, 'expired - time', 'dcruz', 'ðŸ’«ï¸±futures-alerts', 0, '2024-05-20 16:17:27', '1232475403407327303', '480583337661038602', '', 1, 0, '', NULL, NULL),
(155, '05/20/2024 13:46:36', '05/20/2024 13:46:39', 'Futures', 'ES', 1, 'open', 'ES JUN24', 5337.25, 5337.25, 5337.25, 'Enter Long Filled', 'ocean212', 'ðŸ’«ï¸±futures-alerts', 1, '2024-05-20 17:46:36', '1232475403407327303', '180421030605488128', '', 1, 0, '', NULL, NULL),
(156, '05/20/2024 13:50:27', '05/20/2024 13:48:35', 'Futures', 'ES', -1, 'open', 'ES JUN24', 5337.00, 5336.25, 5336, 'Enter Short Filled', 'dcruz', 'ðŸ’«ï¸±futures-alerts', 0, '2024-05-20 16:17:27', '1232475403407327303', '480583337661038602', '', 1, 0, '', NULL, NULL),
(157, '05/20/2024 13:52:27', '05/20/2024 13:48:35', 'Futures', 'ES', 1, 'close', 'ES JUN24', 5337.00, 5336.25, 5336, 'Exit Short Placed', 'dcruz', 'ðŸ’«ï¸±futures-alerts', 0, '2024-05-20 16:17:27', '1232475403407327303', '480583337661038602', '', 1, 0, '', NULL, NULL),
(158, '05/20/2024 13:53:48', NULL, 'Futures', 'ES', 1, 'open', 'ES JUN24', 5333.25, 0.00, 0, 'expired - time', 'steveo21', 'ðŸš€ï¸±member-alerts', 0, '2024-05-20 17:53:48', '1232475511150743632', '493829082924974103', '', 0, 0, '', NULL, NULL),
(159, '05/20/2024 13:54:01', NULL, 'Futures', 'ES', -1, 'close', 'ES JUN24', 5333.25, 5333.50, 0, 'skipped - no long position to close', 'ocean212', 'ðŸ’«ï¸±futures-alerts', 1, '2024-05-20 17:54:01', '1232475403407327303', '180421030605488128', '', 0, 0, '', NULL, NULL),
(160, '05/20/2024 14:01:52', '05/20/2024 14:01:53', 'Futures', 'ES', 1, 'open', 'ES JUN24', 5334.25, 5335.25, 5335.25, 'Enter Long Filled', 'dcruz', 'ðŸ’«ï¸±futures-alerts', 0, '2024-05-20 18:01:52', '1232475403407327303', '480583337661038602', '', 1, 0, '', NULL, NULL),
(161, '05/20/2024 14:08:42', NULL, 'Futures', 'ES', -1, 'close', 'ES JUN24', 5331.25, 5325.75, 0, 'skipped - no long position to close', 'dcruz', 'ðŸ’«ï¸±futures-alerts', 0, '2024-05-20 18:08:42', '1232475403407327303', '480583337661038602', '', 0, 0, '', NULL, NULL),
(162, '05/20/2024 14:08:44', NULL, 'Futures', 'ES', -1, 'close', 'ES JUN24', 5330.25, 0.00, 0, 'expired - time', 'steveo21', 'ðŸš€ï¸±member-alerts', 0, '2024-05-20 18:08:44', '1232475511150743632', '493829082924974103', '', 0, 0, '', NULL, NULL),
(163, '05/21/2024 09:56:56', NULL, 'Futures', 'NQ', -1, 'close', 'NQ JUN24', 18718.00, 0.00, 0, 'expired - time', 'srostrades', 'ðŸ’«ï¸±futures-alerts', 5, '2024-05-21 13:56:56', '1232475403407327303', '500695745339588618', '', 0, 0, '', NULL, NULL),
(164, '05/21/2024 10:25:23', '05/21/2024 10:25:24', 'Futures', 'ES', 1, 'open', 'ES JUN24', 5331.00, 5330.75, 5331, 'Enter Long Filled', 'ocean212', 'ðŸ’«ï¸±futures-alerts', 1, '2024-05-21 14:25:23', '1232475403407327303', '180421030605488128', '', 1, 0, '', NULL, NULL),
(165, '05/21/2024 10:34:20', NULL, 'Futures', 'ES', -1, 'close', 'ES JUN24', 5334.00, 5333.50, 0, 'Exit Long Placed', 'ocean212', 'ðŸ’«ï¸±futures-alerts', 1, '2024-05-21 14:34:20', '1232475403407327303', '180421030605488128', '', 0, 0, '', NULL, NULL),
(166, '05/21/2024 10:37:08', NULL, 'Futures', 'NQ', -1, 'open', 'NQ JUN24', 18755.00, 0.00, 0, 'expired - time', 'srostrades', 'ðŸ’«ï¸±futures-alerts', 5, '2024-05-21 14:37:08', '1232475403407327303', '500695745339588618', '', 0, 0, '', NULL, NULL),
(167, '05/21/2024 10:45:20', NULL, 'Futures', 'NQ', 1, 'close', 'NQ JUN24', 18740.75, 0.00, 0, 'expired - time', 'srostrades', 'ðŸ’«ï¸±futures-alerts', 5, '2024-05-21 14:45:20', '1232475403407327303', '500695745339588618', '', 0, 0, '', NULL, NULL),
(168, '05/21/2024 12:50:52', NULL, 'Futures', 'ES', -1, 'close', 'ES JUN24', 5345.00, 5333.25, 0, 'skipped - no long position to close', 'farazmatin', 'signalchannel', 3, '2024-05-21 16:50:52', '1100830612383879188', '403285053259513858', '', 0, 0, '', NULL, NULL),
(169, '05/21/2024 14:17:24', '05/21/2024 14:17:25', 'Futures', 'ES', 1, 'open', 'ES JUN24', 5337.00, 5337.50, 5337.75, 'Enter Long Filled', 'dcruz', 'ðŸ’«ï¸±futures-alerts', 0, '2024-05-21 18:17:24', '1232475403407327303', '480583337661038602', '', 1, 0, '', NULL, NULL),
(170, '05/21/2024 14:18:15', NULL, 'Futures', 'ES', 1, 'open', 'ES JUN24', 5337.00, 5337.25, 0, 'skipped - long position exists', 'ocean212', 'ðŸ’«ï¸±futures-alerts', 1, '2024-05-21 18:18:15', '1232475403407327303', '180421030605488128', '', 0, 0, '', NULL, NULL),
(171, '05/21/2024 14:30:15', NULL, 'StockOptions', '', 1, 'open', 'MCD_MCDS 230621 C 275', 1.45, 0.00, 0, 'pending', 'farazmatin', 'signalchannel', 1, '2024-05-21 18:30:15', '1100830612383879188', '403285053259513858', '', 0, 0, '', NULL, NULL),
(172, '05/21/2024 14:30:15', NULL, 'StockOptions', '', 1, 'open', 'MCD_MCDS 230621 C 275', 1.45, 0.00, 0, 'pending', 'farazmatin', 'signalchannel', 1, '2024-05-21 18:30:15', '1100830612383879188', '403285053259513858', '', 0, 0, '', NULL, NULL),
(173, '05/21/2024 14:30:15', NULL, 'Futures', 'ES', -1, 'close', 'ES JUN24', 534.00, 5336.00, 0, 'skipped - Mismatched provider', 'farazmatin', 'signalchannel', 3, '2024-05-21 18:30:15', '1100830612383879188', '403285053259513858', '', 0, 0, '', NULL, NULL),
(174, '05/21/2024 14:31:30', NULL, 'Futures', 'ES', -1, 'close', 'ES JUN24', 5345.00, 5337.25, 0, 'skipped - Mismatched provider', 'farazmatin', 'signalchannel', 3, '2024-05-21 18:31:30', '1100830612383879188', '403285053259513858', '', 0, 0, '', NULL, NULL),
(175, '05/21/2024 14:31:30', NULL, 'Futures', 'ES', -1, 'close', 'ES JUN24', 534.00, 5337.25, 0, 'skipped - Mismatched provider', 'farazmatin', 'signalchannel', 3, '2024-05-21 18:31:30', '1100830612383879188', '403285053259513858', '', 0, 0, '', NULL, NULL),
(176, '05/21/2024 14:44:52', NULL, 'Futures', 'ES', 1, 'open', 'ES JUN24', 50000.00, 5334.25, 0, 'skipped - price out of range', 'farazmatin', 'signalchannel', 3, '2024-05-21 18:44:52', '1100830612383879188', '403285053259513858', '', 0, 0, '', NULL, NULL),
(177, '05/21/2024 14:44:52', NULL, 'Futures', 'ES', 1, 'open', 'ES JUN24', 500000.00, 5334.25, 0, 'skipped - price out of range', 'farazmatin', 'signalchannel', 3, '2024-05-21 18:44:52', '1100830612383879188', '403285053259513858', '', 0, 0, '', NULL, NULL),
(178, '05/21/2024 14:45:49', NULL, 'Futures', 'ES', -1, 'close', 'ES JUN24', 50000.00, 5334.50, 0, 'skipped - no long position to close', 'farazmatin', 'signalchannel', 3, '2024-05-21 18:45:49', '1100830612383879188', '403285053259513858', '', 0, 0, '', NULL, NULL),
(179, '05/21/2024 14:45:49', NULL, 'Futures', 'ES', -1, 'close', 'ES JUN24', 5000.00, 5334.50, 0, 'skipped - no long position to close', 'farazmatin', 'signalchannel', 3, '2024-05-21 18:45:49', '1100830612383879188', '403285053259513858', '', 0, 0, '', NULL, NULL),
(180, '05/21/2024 14:49:38', NULL, 'Futures', 'ES', 1, 'open', 'ES JUN24', 12345.00, 5335.25, 0, 'skipped - price out of range', 'farazmatin', 'signalchannel', 3, '2024-05-21 18:49:38', '1100830612383879188', '403285053259513858', '', 0, 0, '', NULL, NULL),
(181, '05/21/2024 14:49:38', NULL, 'Futures', 'ES', 1, 'open', 'ES JUN24', 123456.00, 5335.25, 0, 'skipped - price out of range', 'farazmatin', 'signalchannel', 3, '2024-05-21 18:49:38', '1100830612383879188', '403285053259513858', '', 0, 0, '', NULL, NULL),
(182, '05/21/2024 14:50:24', NULL, 'Futures', 'ES', -1, 'close', 'ES JUN24', 12345678.00, 5335.25, 0, 'skipped - no long position to close', 'farazmatin', 'signalchannel', 3, '2024-05-21 18:50:24', '1100830612383879188', '403285053259513858', '', 0, 0, '', NULL, NULL),
(183, '05/21/2024 14:50:24', NULL, 'Futures', 'ES', -1, 'close', 'ES JUN24', 99999999.99, 5335.25, 0, 'skipped - no long position to close', 'farazmatin', 'signalchannel', 3, '2024-05-21 18:50:24', '1100830612383879188', '403285053259513858', '', 0, 0, '', NULL, NULL),
(184, '05/21/2024 14:51:14', NULL, 'Futures', 'ES', 1, 'open', 'ES JUN24', 12345678.00, 5335.00, 0, 'skipped - price out of range', 'farazmatin', 'signalchannel', 3, '2024-05-21 18:51:14', '1100830612383879188', '403285053259513858', '', 0, 0, '', NULL, NULL),
(185, '05/21/2024 14:51:14', NULL, 'Futures', 'ES', 1, 'open', 'ES JUN24', 99999999.99, 5334.75, 0, 'skipped - price out of range', 'farazmatin', 'signalchannel', 3, '2024-05-21 18:51:14', '1100830612383879188', '403285053259513858', '', 0, 0, '', NULL, NULL),
(186, '05/21/2024 14:57:24', NULL, 'Futures', 'ES', 1, 'open', 'ES JUN24', 1234.00, 5335.75, 0, 'skipped - price out of range', 'farazmatin', 'signalchannel', 3, '2024-05-21 18:57:24', '1100830612383879188', '403285053259513858', '', 0, 0, '', NULL, NULL),
(187, '05/21/2024 15:05:31', NULL, 'Futures', 'ES', 1, 'open', 'ES JUN24', 12345678.00, 5334.50, 0, 'skipped - price out of range', 'farazmatin', 'signalchannel', 3, '2024-05-21 19:05:31', '1100830612383879188', '403285053259513858', '', 0, 0, '', NULL, NULL),
(188, '05/21/2024 15:05:36', NULL, 'StockOptions', '', -1, 'close', 'QQQ_QQQS 230522 C 457', 1.33, 0.00, 0, 'pending', 'dcruz', 'ðŸ’Žï¸±options-stock-alerts', 10, '2024-05-21 19:05:36', '1232475648396759132', '480583337661038602', '', 0, 0, '', NULL, NULL),
(189, '05/21/2024 15:10:47', NULL, 'StockOptions', '', 1, 'open', 'MCD_MCDS 230621 C 275', 1.40, 0.00, 0, 'pending', 'farazmatin', 'signalchannel', 1, '2024-05-21 19:10:47', '1100830612383879188', '403285053259513858', '', 0, 0, '', NULL, NULL),
(190, '05/21/2024 15:14:13', NULL, 'Futures', 'ES', -1, 'close', 'ES JUN24', 534.00, 5340.25, 0, 'skipped - no long position to close', 'ocean212', 'ðŸ’«ï¸±futures-alerts', 1, '2024-05-21 19:14:13', '1232475403407327303', '180421030605488128', '', 0, 0, '', NULL, NULL),
(191, '05/21/2024 15:14:44', NULL, 'Futures', 'ES', -1, 'close', 'ES JUN24', 534.00, 5340.50, 0, 'skipped - no long position to close', 'dcruz', 'ðŸ’«ï¸±futures-alerts', 0, '2024-05-21 19:14:44', '1232475403407327303', '480583337661038602', '', 0, 0, '', NULL, NULL),
(192, '05/21/2024 15:25:47', NULL, 'Futures', 'ES', 1, 'open', 'ES JUN24', 12345678.00, 5339.50, 0, 'skipped - price out of range', 'farazmatin', 'signalchannel', 3, '2024-05-21 19:25:47', '1100830612383879188', '403285053259513858', '', 0, 0, '', NULL, NULL),
(193, '05/21/2024 15:26:25', NULL, 'StockOptions', '', 1, 'open', 'MCD_MCDS 230621 C 275', 1.40, 0.00, 0, 'pending', 'farazmatin', 'signalchannel', 1, '2024-05-21 19:26:25', '1100830612383879188', '403285053259513858', '', 0, 0, '', NULL, NULL),
(194, '05/21/2024 15:26:54', NULL, 'StockOptions', '', 1, 'open', 'MCD_MCDS 230621 C 275', 1.40, 0.00, 0, 'pending', 'farazmatin', 'signalchannel', 1, '2024-05-21 19:26:54', '1100830612383879188', '403285053259513858', '', 0, 0, '', NULL, NULL),
(195, '05/21/2024 15:26:54', NULL, 'Futures', 'ES', 1, 'open', 'ES JUN24', 12345678.00, 5339.50, 0, 'skipped - price out of range', 'farazmatin', 'signalchannel', 3, '2024-05-21 19:26:54', '1100830612383879188', '403285053259513858', '', 0, 0, '', NULL, NULL),
(196, '05/21/2024 15:27:04', '05/21/2024 15:27:05', 'Futures', 'ES', -1, 'open', 'ES JUN24', 5339.50, 5338.50, 5338.25, 'Enter Short Filled', 'dcruz', 'ðŸ’«ï¸±futures-alerts', 0, '2024-05-21 19:27:04', '1232475403407327303', '480583337661038602', '', 1, 0, '', NULL, NULL),
(197, '05/21/2024 15:28:19', NULL, 'StockOptions', '', 1, 'open', 'MCD_MCDS 230621 C 275', 4.16, 0.00, 0, 'pending', 'farazmatin', 'signalchannel', 1, '2024-05-21 19:28:19', '1100830612383879188', '403285053259513858', '', 0, 0, '', NULL, NULL),
(198, '05/21/2024 15:28:19', NULL, 'Futures', 'ES', 1, 'open', 'ES JUN24', 98765432.00, 5339.25, 0, 'skipped - position is not flat', 'farazmatin', 'signalchannel', 3, '2024-05-21 19:28:19', '1100830612383879188', '403285053259513858', '', 0, 0, '', NULL, NULL),
(199, '05/21/2024 15:29:07', NULL, 'StockOptions', '', 1, 'open', 'MCD_MCDS 230621 C 275', 4.16, 0.00, 0, 'pending', 'farazmatin', 'signalchannel', 1, '2024-05-21 19:29:07', '1100830612383879188', '403285053259513858', '', 0, 0, '', NULL, NULL),
(200, '05/21/2024 15:29:07', NULL, 'Futures', 'ES', 1, 'open', 'ES JUN24', 98765432.00, 5339.00, 0, 'skipped - position is not flat', 'farazmatin', 'signalchannel', 3, '2024-05-21 19:29:07', '1100830612383879188', '403285053259513858', '', 0, 0, '', NULL, NULL),
(201, '05/21/2024 15:30:07', NULL, 'Futures', 'ES', 1, 'open', 'ES JUN24', 588.00, 5340.00, 0, 'skipped - position is not flat', 'farazmatin', 'signalchannel', 3, '2024-05-21 19:30:07', '1100830612383879188', '403285053259513858', '', 0, 0, '', NULL, NULL),
(203, '05/21/2024 15:30:46', NULL, 'Futures', 'ES', 1, 'open', 'ES JUN24', 1600.00, 5340.75, 0, 'skipped - position is not flat', 'farazmatin', 'signalchannel', 3, '2024-05-21 19:30:46', '1100830612383879188', '403285053259513858', '', 0, 0, '', NULL, NULL),
(204, '05/21/2024 15:31:36', NULL, 'Futures', 'ES', 1, 'close', 'ES JUN24', 5341.20, 5342.00, 0, 'skipped - no short position to close', 'dcruz', 'ðŸ’«ï¸±futures-alerts', 0, '2024-05-21 19:31:36', '1232475403407327303', '480583337661038602', '', 0, 0, '', NULL, NULL);
INSERT INTO `signals` (`id`, `CreationTime`, `ExecutedTime`, `AssetType`, `InstrumentType`, `Action`, `Side`, `Instrument`, `Price`, `MarketPrice`, `FillPrice`, `Status`, `ProviderName`, `ChannelName`, `Quantity`, `TimeStamp`, `Channel_id`, `Provider_id`, `asset_id`, `ExecutedQuantity`, `user_id`, `webhook_URL`, `Userkey`, `Reason`) VALUES
(205, '05/21/2024 15:44:53', NULL, 'Futures', 'ES', 1, 'open', 'ES JUN24', 1600.00, 5341.75, 0, 'skipped - price out of range', 'farazmatin', 'signalchannel', 3, '2024-05-21 19:44:53', '1100830612383879188', '403285053259513858', '', 0, 0, '', NULL, NULL),
(206, '05/21/2024 15:45:39', NULL, 'Futures', 'ES', 1, 'close', 'ES JUN24', 5341.20, 5341.50, 0, 'skipped - no short position to close', 'farazmatin', 'signalchannel', 0, '2024-05-21 19:45:39', '1100830612383879188', '403285053259513858', '', 0, 0, '', NULL, NULL),
(207, '05/21/2024 15:46:06', NULL, 'Futures', 'ES', 1, 'close', 'ES JUN24', 5341.20, 5341.50, 0, 'skipped - no short position to close', 'farazmatin', 'signalchannel', 2, '2024-05-21 19:46:06', '1100830612383879188', '403285053259513858', '', 0, 0, '', NULL, NULL),
(208, '05/21/2024 15:47:04', NULL, 'Futures', 'ES', 1, 'close', 'ES JUN24', 1600.00, 5341.25, 0, 'skipped - no short position to close', 'farazmatin', 'signalchannel', 2, '2024-05-21 19:47:04', '1100830612383879188', '403285053259513858', '', 0, 0, '', NULL, NULL),
(209, '05/21/2024 15:49:18', NULL, 'Futures', 'ES', 1, 'open', 'ES JUN24', 99999999.99, 5341.00, 0, 'skipped - price out of range', 'farazmatin', 'signalchannel', 3, '2024-05-21 19:49:18', '1100830612383879188', '403285053259513858', '', 0, 0, '', NULL, NULL),
(210, '05/21/2024 15:49:18', NULL, 'Futures', 'ES', -1, 'open', 'ES JUN24', 99999999.99, 5341.00, 0, 'skipped - price out of range', 'farazmatin', 'signalchannel', 3, '2024-05-21 19:49:18', '1100830612383879188', '403285053259513858', '', 0, 0, '', NULL, NULL),
(211, '05/21/2024 15:49:18', NULL, 'Futures', 'ES', 1, 'open', 'ES JUN24', 5888.00, 5341.00, 0, 'skipped - price out of range', 'farazmatin', 'signalchannel', 3, '2024-05-21 19:49:18', '1100830612383879188', '403285053259513858', '', 0, 0, '', NULL, NULL),
(212, '05/21/2024 15:49:18', NULL, 'Futures', 'ES', 1, 'open', 'ES JUN24', 16000.00, 5341.00, 0, 'skipped - price out of range', 'farazmatin', 'signalchannel', 3, '2024-05-21 19:49:18', '1100830612383879188', '403285053259513858', '', 0, 0, '', NULL, NULL),
(213, '05/21/2024 15:49:18', NULL, 'Futures', 'ES', 1, 'close', 'ES JUN24', 16000.00, 5341.00, 0, 'skipped - no short position to close', 'farazmatin', 'signalchannel', 3, '2024-05-21 19:49:18', '1100830612383879188', '403285053259513858', '', 0, 0, '', NULL, NULL),
(214, '05/21/2024 15:58:25', NULL, 'StockOptions', '', 1, 'open', 'MCD_MCDS 230621 C 275', 4.16, 0.00, 0, 'pending', 'farazmatin', 'signalchannel', 1, '2024-05-21 19:58:25', '1100830612383879188', '403285053259513858', '', 0, 0, '', NULL, NULL),
(215, '05/21/2024 15:58:25', NULL, 'StockOptions', '', 1, 'open', 'MCD_MCDS 230621 C 275', 4.16, 0.00, 0, 'pending', 'farazmatin', 'signalchannel', 1, '2024-05-21 19:58:25', '1100830612383879188', '403285053259513858', '', 0, 0, '', NULL, NULL),
(216, '05/21/2024 15:58:25', NULL, 'Futures', 'ES', 1, 'open', 'ES JUN24', 0.00, 5346.75, 0, 'skipped - price out of range', 'farazmatin', 'signalchannel', 3, '2024-05-21 19:58:25', '1100830612383879188', '403285053259513858', '', 0, 0, '', NULL, NULL),
(217, '05/21/2024 15:58:25', NULL, 'Futures', 'ES', 1, 'close', 'ES JUN24', 0.00, 5346.75, 0, 'skipped - no short position to close', 'farazmatin', 'signalchannel', 0, '2024-05-21 19:58:25', '1100830612383879188', '403285053259513858', '', 0, 0, '', NULL, NULL),
(218, '05/21/2024 15:58:25', NULL, 'Futures', 'ES', 1, 'close', 'ES JUN24', 0.00, 5346.75, 0, 'skipped - no short position to close', 'farazmatin', 'signalchannel', 2, '2024-05-21 19:58:25', '1100830612383879188', '403285053259513858', '', 0, 0, '', NULL, NULL),
(219, '05/21/2024 15:58:25', NULL, 'Futures', 'ES', 1, 'close', 'ES JUN24', 0.00, 5347.00, 0, 'skipped - no short position to close', 'farazmatin', 'signalchannel', 2, '2024-05-21 19:58:25', '1100830612383879188', '403285053259513858', '', 0, 0, '', NULL, NULL),
(220, '05/21/2024 15:58:25', NULL, 'Futures', 'ES', 1, 'open', 'ES JUN24', 0.00, 5347.00, 0, 'skipped - price out of range', 'farazmatin', 'signalchannel', 3, '2024-05-21 19:58:25', '1100830612383879188', '403285053259513858', '', 0, 0, '', NULL, NULL),
(221, '05/21/2024 15:58:25', NULL, 'Futures', 'ES', 1, 'open', 'ES JUN24', 0.00, 5346.75, 0, 'skipped - price out of range', 'farazmatin', 'signalchannel', 3, '2024-05-21 19:58:25', '1100830612383879188', '403285053259513858', '', 0, 0, '', NULL, NULL),
(222, '05/21/2024 15:58:25', NULL, 'Futures', 'ES', 1, 'open', 'ES JUN24', 0.00, 5346.75, 0, 'skipped - price out of range', 'farazmatin', 'signalchannel', 3, '2024-05-21 19:58:25', '1100830612383879188', '403285053259513858', '', 0, 0, '', NULL, NULL),
(223, '05/21/2024 15:58:25', NULL, 'Futures', 'ES', 1, 'open', 'ES JUN24', 0.00, 5346.75, 0, 'skipped - price out of range', 'farazmatin', 'signalchannel', 3, '2024-05-21 19:58:25', '1100830612383879188', '403285053259513858', '', 0, 0, '', NULL, NULL),
(224, '05/21/2024 15:58:25', NULL, 'Futures', 'ES', 1, 'open', 'ES JUN24', 0.00, 5346.75, 0, 'skipped - price out of range', 'farazmatin', 'signalchannel', 3, '2024-05-21 19:58:25', '1100830612383879188', '403285053259513858', '', 0, 0, '', NULL, NULL),
(225, '05/21/2024 15:58:25', NULL, 'Futures', 'ES', 1, 'open', 'ES JUN24', 0.00, 5346.75, 0, 'skipped - price out of range', 'farazmatin', 'signalchannel', 3, '2024-05-21 19:58:25', '1100830612383879188', '403285053259513858', '', 0, 0, '', NULL, NULL),
(226, '05/21/2024 15:58:25', NULL, 'Futures', 'ES', -1, 'open', 'ES JUN24', 0.00, 5347.00, 0, 'skipped - price out of range', 'farazmatin', 'signalchannel', 3, '2024-05-21 19:58:25', '1100830612383879188', '403285053259513858', '', 0, 0, '', NULL, NULL),
(227, '05/21/2024 15:58:25', NULL, 'Futures', 'ES', 1, 'open', 'ES JUN24', 0.00, 5347.00, 0, 'skipped - price out of range', 'farazmatin', 'signalchannel', 3, '2024-05-21 19:58:25', '1100830612383879188', '403285053259513858', '', 0, 0, '', NULL, NULL),
(228, '05/21/2024 15:58:25', NULL, 'Futures', 'ES', 1, 'open', 'ES JUN24', 0.00, 5347.00, 0, 'skipped - price out of range', 'farazmatin', 'signalchannel', 3, '2024-05-21 19:58:25', '1100830612383879188', '403285053259513858', '', 0, 0, '', NULL, NULL),
(229, '05/21/2024 15:58:25', NULL, 'Futures', 'ES', 1, 'close', 'ES JUN24', 0.00, 5347.00, 0, 'skipped - no short position to close', 'farazmatin', 'signalchannel', 3, '2024-05-21 19:58:25', '1100830612383879188', '403285053259513858', '', 0, 0, '', NULL, NULL),
(230, '05/21/2024 15:58:25', NULL, 'Futures', 'ES', 1, 'open', 'ES JUN24', 0.00, 5347.00, 0, 'skipped - price out of range', 'farazmatin', 'signalchannel', 3, '2024-05-21 19:58:25', '1100830612383879188', '403285053259513858', '', 0, 0, '', NULL, NULL),
(231, '05/21/2024 15:58:25', NULL, 'Futures', 'ES', -1, 'open', 'ES JUN24', 0.00, 5346.75, 0, 'skipped - price out of range', 'farazmatin', 'signalchannel', 3, '2024-05-21 19:58:25', '1100830612383879188', '403285053259513858', '', 0, 0, '', NULL, NULL),
(232, '05/21/2024 15:58:25', NULL, 'Futures', 'ES', 1, 'open', 'ES JUN24', 0.00, 5346.75, 0, 'skipped - price out of range', 'farazmatin', 'signalchannel', 3, '2024-05-21 19:58:25', '1100830612383879188', '403285053259513858', '', 0, 0, '', NULL, NULL),
(233, '05/21/2024 15:58:25', NULL, 'Futures', 'ES', 1, 'open', 'ES JUN24', 0.00, 5347.00, 0, 'skipped - price out of range', 'farazmatin', 'signalchannel', 3, '2024-05-21 19:58:25', '1100830612383879188', '403285053259513858', '', 0, 0, '', NULL, NULL),
(234, '05/21/2024 15:58:25', NULL, 'Futures', 'ES', 1, 'close', 'ES JUN24', 0.00, 5347.00, 0, 'skipped - no short position to close', 'farazmatin', 'signalchannel', 3, '2024-05-21 19:58:25', '1100830612383879188', '403285053259513858', '', 0, 0, '', NULL, NULL),
(235, '05/21/2024 16:11:50', NULL, 'Stocks-Forex', '', -1, '', 'AAPL', 0.00, 0.00, 0, 'pending', 'farazmatin', 'signalchannel', 5, '2024-05-21 20:11:50', '1100830612383879188', '403285053259513858', '', 0, 0, '', NULL, NULL),
(236, '05/21/2024 22:39:18', NULL, 'Futures', 'ES', 1, 'close', 'ES JUN24', 0.00, 5346.75, 0, 'skipped - no short position to close', 'farazmatin', 'signalchannel', 3, '2024-05-22 02:39:18', '1100830612383879188', '403285053259513858', '', 0, 0, '', NULL, NULL),
(237, '05/21/2024 22:39:18', NULL, 'Stocks-Forex', '', -1, '', 'AAPL', 0.00, 0.00, 0, 'pending', 'farazmatin', 'signalchannel', 5, '2024-05-22 02:39:18', '1100830612383879188', '403285053259513858', '', 0, 0, '', NULL, NULL),
(238, '05/21/2024 22:39:27', NULL, 'StockOptions', '', 1, 'open', 'MCD_MCDS 230621 C 275', 4.16, 0.00, 0, 'pending', 'farazmatin', 'signalchannel', 1, '2024-05-22 02:39:27', '1100830612383879188', '403285053259513858', '', 0, 0, '', NULL, NULL),
(239, '05/21/2024 22:51:47', NULL, 'Futures', 'ES', 1, 'open', 'ES JUN24', 123456.00, 5346.50, 0, 'skipped - price out of range', 'farazmatin', 'signalchannel', 3, '2024-05-22 02:51:47', '1100830612383879188', '403285053259513858', '', 0, 0, '', NULL, NULL),
(240, '05/21/2024 22:51:47', NULL, 'Futures', 'ES', -1, 'close', 'ES JUN24', 99999999.99, 5346.50, 0, 'skipped - no long position to close', 'farazmatin', 'signalchannel', 3, '2024-05-22 02:51:47', '1100830612383879188', '403285053259513858', '', 0, 0, '', NULL, NULL),
(241, '05/21/2024 22:51:55', NULL, 'StockOptions', '', 1, 'open', 'MCD_MCDS 230621 C 275', 4.16, 0.00, 0, 'pending', 'farazmatin', 'signalchannel', 1, '2024-05-22 02:51:55', '1100830612383879188', '403285053259513858', '', 0, 0, '', NULL, NULL),
(242, '05/21/2024 22:52:56', NULL, 'Stocks-Forex', '', -1, '', 'AAPL', 1.17, 0.00, 0, 'pending', 'farazmatin', 'signalchannel', 5, '2024-05-22 02:52:56', '1100830612383879188', '403285053259513858', '', 0, 0, '', NULL, NULL),
(243, '05/21/2024 22:58:10', NULL, 'StockOptions', '', 1, 'open', 'MCD_MCDS 230621 C 275', 4.16, 0.00, 0, 'pending', 'farazmatin', 'signalchannel', 1, '2024-05-22 02:58:10', '1100830612383879188', '403285053259513858', '', 0, 0, '', NULL, NULL),
(244, '05/21/2024 22:58:10', NULL, 'Stocks-Forex', '', -1, 'close', 'AAPL', 1.17, 0.00, 0, 'pending', 'farazmatin', 'signalchannel', 5, '2024-05-22 02:58:10', '1100830612383879188', '403285053259513858', '', 0, 0, '', NULL, NULL),
(245, '05/21/2024 22:58:11', NULL, 'Futures', 'ES', 1, 'close', 'ES JUN24', 16000.00, 5346.75, 0, 'skipped - no short position to close', 'farazmatin', 'signalchannel', 3, '2024-05-22 02:58:11', '1100830612383879188', '403285053259513858', '', 0, 0, '', NULL, NULL),
(246, '05/21/2024 23:05:19', NULL, 'StockOptions', '275', 1, 'open', 'MCD_MCDS 230621 C 275', 4.16, 0.00, 0, 'pending', 'farazmatin', 'signalchannel', 1, '2024-05-22 03:05:19', '1100830612383879188', '403285053259513858', '', 0, 0, '', NULL, NULL),
(247, '05/21/2024 23:05:19', NULL, 'Futures', 'ES', 1, 'close', 'ES JUN24', 16000.00, 5346.50, 0, 'skipped - no short position to close', 'farazmatin', 'signalchannel', 3, '2024-05-22 03:05:19', '1100830612383879188', '403285053259513858', '', 0, 0, '', NULL, NULL),
(248, '05/21/2024 23:05:19', NULL, 'Stocks-Forex', '', -1, 'close', 'AAPL', 1.17, 0.00, 0, 'pending', 'farazmatin', 'signalchannel', 5, '2024-05-22 03:05:19', '1100830612383879188', '403285053259513858', '', 0, 0, '', NULL, NULL),
(249, '05/21/2024 23:08:18', NULL, 'StockOptions', 'MCD', 1, 'open', 'MCD_MCDS 230621 C 275', 4.16, 0.00, 0, 'pending', 'farazmatin', 'signalchannel', 1, '2024-05-22 03:08:18', '1100830612383879188', '403285053259513858', '', 0, 0, '', NULL, NULL),
(250, '05/21/2024 23:08:18', NULL, 'Futures', 'ES', 1, 'close', 'ES JUN24', 16000.00, 5346.25, 0, 'skipped - no short position to close', 'farazmatin', 'signalchannel', 3, '2024-05-22 03:08:18', '1100830612383879188', '403285053259513858', '', 0, 0, '', NULL, NULL),
(251, '05/21/2024 23:08:18', NULL, 'Stocks-Forex', 'AAPL', -1, 'close', 'AAPL', 1.17, 0.00, 0, 'pending', 'farazmatin', 'signalchannel', 5, '2024-05-22 03:08:18', '1100830612383879188', '403285053259513858', '', 0, 0, '', NULL, NULL),
(252, '05/22/2024 02:06:03', NULL, 'Futures', 'ES', -1, 'close', 'ES JUN24', 5344.50, 5344.25, 0, 'skipped - no long position to close', 'ocean212', 'ðŸ’«ï¸±futures-alerts', 1, '2024-05-22 06:06:03', '1232475403407327303', '180421030605488128', '', 0, 0, '', NULL, NULL),
(253, '05/22/2024 10:56:03', NULL, 'Futures', 'ES', 1, 'open', 'ES JUN24', 123456.00, 5340.75, 0, 'skipped - price out of range', 'farazmatin', 'signalchannel', 3, '2024-05-22 14:56:03', '1100830612383879188', '403285053259513858', '', 0, 0, '', NULL, NULL),
(254, '05/22/2024 11:06:15', NULL, 'Futures', 'ES', 1, 'close', 'ES JUN24', 5344.25, 0.00, 0, 'expired - time', 'trav_trades', 'ðŸ’«ï¸±futures-alerts', 3, '2024-05-22 15:06:15', '1232475403407327303', '399929170928467968', '', 0, 0, '', NULL, NULL),
(255, '05/22/2024 11:06:33', NULL, 'Futures', 'ES', -1, 'close', 'ES JUN24', 5344.00, 5344.25, 0, 'skipped - no long position to close', 'ocean212', 'ðŸ’«ï¸±futures-alerts', 1, '2024-05-22 15:06:33', '1232475403407327303', '180421030605488128', '', 0, 0, '', NULL, NULL),
(256, '05/22/2024 11:14:14', NULL, 'StockOptions', 'CRWD', -1, 'close', 'CRWD_CRWDS 230524 C 360', 0.82, 0.00, 0, 'pending', 'moonshotdg', 'ðŸ’Žï¸±options-stock-alerts', 2, '2024-05-22 15:14:14', '1232475648396759132', '936406954706878555', '', 0, 0, '', NULL, NULL),
(257, '05/22/2024 11:15:00', NULL, 'StockOptions', 'CRWD', -1, 'close', 'CRWD_CRWDS 230524 C 360', 0.82, 0.00, 0, 'pending', 'moonshotdg', 'ðŸ’Žï¸±options-stock-alerts', 2, '2024-05-22 15:15:00', '1232475648396759132', '936406954706878555', '', 0, 0, '', NULL, NULL),
(258, '05/22/2024 11:18:46', NULL, 'Futures', 'GC', 1, 'open', 'GC JUN24', 2394.50, 0.00, 0, 'pending', 'trav_trades', 'ðŸ’«ï¸±futures-alerts', 3, '2024-05-22 15:18:46', '1232475403407327303', '399929170928467968', '', 0, 0, '', NULL, NULL),
(259, '05/22/2024 11:21:42', NULL, 'Futures', 'GC', -1, 'close', 'GC JUN24', 2396.10, 0.00, 0, 'pending', 'trav_trades', 'ðŸ’«ï¸±futures-alerts', 3, '2024-05-22 15:21:42', '1232475403407327303', '399929170928467968', '', 0, 0, '', NULL, NULL),
(260, '05/22/2024 11:22:03', NULL, 'Futures', 'ES', -1, 'close', 'ES JUN24', 5343.50, 5342.25, 0, 'skipped - no long position to close', 'dcruz', 'ðŸ’«ï¸±futures-alerts', 0, '2024-05-22 15:22:03', '1232475403407327303', '480583337661038602', '', 0, 0, '', NULL, NULL),
(261, '05/22/2024 11:29:54', NULL, 'Stocks-Forex', 'MGCM', 1, 'open', 'MGCM', 2392.70, 0.00, 0, 'pending', 'presten.7', 'ðŸ’«ï¸±futures-alerts', 2, '2024-05-22 15:29:54', '1232475403407327303', '820065977584451636', '', 0, 0, '', NULL, NULL),
(262, '05/22/2024 11:31:59', NULL, 'Futures', 'ES', 1, 'open', 'ES JUN24', 5340.75, 0.00, 0, 'expired - time', 'trav_trades', 'ðŸ’«ï¸±futures-alerts', 3, '2024-05-22 15:31:59', '1232475403407327303', '399929170928467968', '', 0, 0, '', NULL, NULL),
(263, '05/22/2024 11:35:35', '05/22/2024 11:35:35', 'Futures', 'ES', 1, 'open', 'ES JUN24', 5340.75, 5341.00, 5341, 'Enter Long Filled', 'dcruz', 'ðŸ’«ï¸±futures-alerts', 0, '2024-05-22 15:35:35', '1232475403407327303', '480583337661038602', '', 1, 0, '', NULL, NULL),
(264, '05/22/2024 11:44:29', NULL, 'Futures', 'ES', -1, 'close', 'ES JUN24', 5340.75, 0.00, 0, 'expired - time', 'trav_trades', 'ðŸ’«ï¸±futures-alerts', 3, '2024-05-22 15:44:29', '1232475403407327303', '399929170928467968', '', 0, 0, '', NULL, NULL),
(265, '05/22/2024 11:50:25', NULL, 'Futures', 'ES', -1, 'close', 'ES JUN24', 5338.75, 5337.00, 0, 'skipped - no long position to close', 'dcruz', 'ðŸ’«ï¸±futures-alerts', 0, '2024-05-22 15:50:25', '1232475403407327303', '480583337661038602', '', 0, 0, '', NULL, NULL),
(266, '05/22/2024 11:50:50', '05/22/2024 11:50:50', 'Futures', 'ES', 1, 'open', 'ES JUN24', 5334.25, 5335.25, 5335.5, 'Enter Long Filled', 'ocean212', 'ðŸ’«ï¸±futures-alerts', 1, '2024-05-22 15:50:50', '1232475403407327303', '180421030605488128', '', 1, 0, '', NULL, NULL),
(267, '05/22/2024 11:53:00', NULL, 'Futures', 'ES', -1, 'close', 'ES JUN24', 5337.25, 5337.00, 0, 'Exit Long Placed', 'ocean212', 'ðŸ’«ï¸±futures-alerts', 1, '2024-05-22 15:53:00', '1232475403407327303', '180421030605488128', '', 0, 0, '', NULL, NULL),
(268, '05/22/2024 11:55:01', NULL, 'StockOptions', 'XOM', -1, 'close', 'XOM_XOMS 230524 C 117', 0.44, 0.00, 0, 'pending', 'farazmatin', 'signalchannel', 50, '2024-05-22 15:55:01', '1100830612383879188', '403285053259513858', '', 0, 0, '', NULL, NULL),
(269, '05/22/2024 11:55:01', NULL, 'StockOptions', 'NKE', -1, 'close', 'NKE_NKES 230524 C 94', 0.17, 0.00, 0, 'pending', 'farazmatin', 'signalchannel', 3, '2024-05-22 15:55:01', '1100830612383879188', '403285053259513858', '', 0, 0, '', NULL, NULL),
(270, '05/22/2024 11:55:01', NULL, 'StockOptions', 'AMD', 1, 'open', 'AMD_AMDS 230524 C 175', 1.30, 0.00, 0, 'pending', 'farazmatin', 'signalchannel', 5, '2024-05-22 15:55:01', '1100830612383879188', '403285053259513858', '', 0, 0, '', NULL, NULL),
(271, '05/22/2024 11:55:01', NULL, 'StockOptions', 'CRWD', -1, 'close', 'CRWD_CRWDS 230524 C 360', 0.82, 0.00, 0, 'pending', 'farazmatin', 'signalchannel', 2, '2024-05-22 15:55:01', '1100830612383879188', '403285053259513858', '', 0, 0, '', NULL, NULL),
(272, '05/22/2024 11:58:54', NULL, 'Stocks-Forex', 'MGCM', 1, 'open', 'MGCM', 2392.70, 0.00, 0, 'pending', 'presten.7', 'ðŸ’«ï¸±futures-alerts', 2, '2024-05-22 15:29:54', '1232475403407327303', '820065977584451636', '', 0, 0, '', NULL, NULL),
(273, '05/22/2024 11:58:50', NULL, 'Futures', 'GC', 1, 'open', 'GC JUN24', 2396.10, 0.00, 0, 'pending', 'trav_trades', 'ðŸ’«ï¸±futures-alerts', 3, '2024-05-22 15:58:50', '1232475403407327303', '399929170928467968', '', 0, 0, '', NULL, NULL),
(274, '05/22/2024 11:59:17', NULL, 'Futures', 'ES', 1, 'close', 'ES JUN24', 16000.00, 5338.25, 0, 'skipped - no short position to close', 'farazmatin', 'signalchannel', 3, '2024-05-22 15:59:17', '1100830612383879188', '403285053259513858', '', 0, 0, '', NULL, NULL),
(275, '05/22/2024 12:01:54', NULL, 'Stocks-Forex', 'MGCM', -1, 'close', 'MGCM', 2397.40, 0.00, 0, 'pending', 'presten.7', 'ðŸ’«ï¸±futures-alerts', 2, '2024-05-22 16:01:54', '1232475403407327303', '820065977584451636', '', 0, 0, '', NULL, NULL),
(276, '05/22/2024 12:02:21', NULL, 'Futures', 'GC', -1, 'close', 'GC JUN24', 2397.30, 0.00, 0, 'pending', 'trav_trades', 'ðŸ’«ï¸±futures-alerts', 3, '2024-05-22 16:02:21', '1232475403407327303', '399929170928467968', '', 0, 0, '', NULL, NULL),
(277, '05/22/2024 12:23:36', NULL, 'Futures', 'ES', 1, 'open', 'ES JUN24', 5340.50, 0.00, 0, 'expired - time', 'dcruz', 'ðŸ’«ï¸±futures-alerts', 0, '2024-05-22 16:23:36', '1232475403407327303', '480583337661038602', '', 0, 0, '', NULL, NULL),
(278, '05/22/2024 12:37:37', NULL, 'Futures', 'NQ', 1, 'open', 'NQ JUN24', 18808.00, 0.00, 0, 'expired - time', 'srostrades', 'ðŸ’«ï¸±futures-alerts', 10, '2024-05-22 16:37:37', '1232475403407327303', '500695745339588618', '', 0, 0, '', NULL, NULL),
(279, '05/22/2024 12:41:01', NULL, 'Futures', 'NQ', 1, 'close', 'NQ JUN24', 18819.00, 0.00, 0, 'expired - time', 'srostrades', 'ðŸ’«ï¸±futures-alerts', 7, '2024-05-22 16:41:01', '1232475403407327303', '500695745339588618', '', 0, 0, '', NULL, NULL),
(280, '05/22/2024 12:42:16', NULL, 'Futures', 'NQ', -1, 'close', 'NQ JUN24', 18819.00, 0.00, 0, 'expired - time', 'srostrades', 'ðŸ’«ï¸±futures-alerts', 7, '2024-05-22 16:42:16', '1232475403407327303', '500695745339588618', '', 0, 0, '', NULL, NULL),
(281, '05/22/2024 12:47:12', NULL, 'Futures', 'NQ', -1, 'close', 'NQ JUN24', 18812.00, 18801.25, 0, 'skipped - no long position to close', 'srostrades', 'ðŸ’«ï¸±futures-alerts', 3, '2024-05-22 16:47:12', '1232475403407327303', '500695745339588618', '', 0, 0, '', NULL, NULL),
(282, '05/22/2024 12:49:58', NULL, 'Futures', 'ES', -1, 'open', 'ES JUN24', 5339.25, 5339.25, 0, 'skipped - price out of range', 'ocean212', 'ðŸ’«ï¸±futures-alerts', 1, '2024-05-22 16:49:58', '1232475403407327303', '180421030605488128', '', 0, 0, '', NULL, NULL),
(283, '05/22/2024 12:56:34', NULL, 'Futures', 'GC', 1, 'open', 'GC JUN24', 2396.90, 0.00, 0, 'pending', 'trav_trades', 'ðŸ’«ï¸±futures-alerts', 3, '2024-05-22 16:56:34', '1232475403407327303', '399929170928467968', '', 0, 0, '', NULL, NULL),
(284, '05/22/2024 13:04:44', NULL, 'Futures', 'GC', -1, 'close', 'GC JUN24', 2396.10, 0.00, 0, 'pending', 'trav_trades', 'ðŸ’«ï¸±futures-alerts', 3, '2024-05-22 17:04:44', '1232475403407327303', '399929170928467968', '', 0, 0, '', NULL, NULL),
(285, '05/22/2024 13:09:19', NULL, 'StockOptions', 'XOM', -1, 'close', 'XOM_XOMS 230524 C 117', 0.54, 0.00, 0, 'pending', 'bcf', 'ðŸ’Žï¸±options-stock-alerts', 50, '2024-05-22 17:09:19', '1232475648396759132', '526074289640833025', '', 0, 0, '', NULL, NULL),
(286, '05/22/2024 13:09:23', NULL, 'Futures', 'ES', 1, 'close', 'ES JUN24', 5342.25, 5341.75, 0, 'skipped - no short position to close', 'ocean212', 'ðŸ’«ï¸±futures-alerts', 1, '2024-05-22 17:09:23', '1232475403407327303', '180421030605488128', '', 0, 0, '', NULL, NULL),
(287, '05/22/2024 13:17:22', NULL, 'Futures', 'ES', -1, 'close', 'ES JUN24', 5343.50, 5342.75, 0, 'skipped - no long position to close', 'dcruz', 'ðŸ’«ï¸±futures-alerts', 0, '2024-05-22 17:17:22', '1232475403407327303', '480583337661038602', '', 0, 0, '', NULL, NULL),
(288, '05/22/2024 13:49:49', NULL, 'Stocks-Forex', '', 1, 'open', 'MES', 5333.25, 0.00, 0, 'pending', 'farazmatin', 'signalchannel', 5, '2024-05-22 17:49:49', '1100830612383879188', '403285053259513858', '', 0, 0, '', NULL, NULL),
(289, '05/22/2024 14:04:30', NULL, 'Futures', 'ES', 1, 'open', 'ES JUN24', 5316.75, 0.00, 0, 'expired - time', 'dcruz', 'ðŸ’«ï¸±futures-alerts', 0, '2024-05-22 18:04:30', '1232475403407327303', '480583337661038602', '', 0, 0, '', NULL, NULL),
(290, '05/22/2024 14:05:39', NULL, 'Futures', 'ES', -1, 'close', 'ES JUN24', 5324.75, 5331.25, 0, 'skipped - no long position to close', 'dcruz', 'ðŸ’«ï¸±futures-alerts', 0, '2024-05-22 18:05:39', '1232475403407327303', '480583337661038602', '', 0, 0, '', NULL, NULL),
(291, '05/22/2024 14:11:42', NULL, 'StockOptions', '', 1, 'open', 'COIN_COINS 230719 C 350', 5.65, 0.00, 0, 'pending', 'evapanda', 'ðŸ’Žï¸±options-stock-alerts', 3, '2024-05-22 18:11:42', '1232475648396759132', '536430344489009153', '', 0, 0, '', NULL, NULL),
(292, '05/22/2024 14:19:25', NULL, 'StockOptions', '', -1, 'close', 'PFE_PFES 230920 C 29', 1.72, 0.00, 0, 'pending', 'jw2014', 'ðŸ’Žï¸±options-stock-alerts', 3, '2024-05-22 18:19:25', '1232475648396759132', '625952281040257034', '', 0, 0, '', NULL, NULL),
(293, '05/23/2024 00:33:23', NULL, 'StockOptions', '', -1, 'close', 'XOM_XOMS 230524 C 117', 0.44, 0.00, 0, 'pending', 'farazmatin', 'signalchannel', 50, '2024-05-23 04:33:23', '1100830612383879188', '403285053259513858', '', 0, 0, '', NULL, NULL),
(294, '05/23/2024 00:33:23', NULL, 'StockOptions', '', -1, 'close', 'NKE_NKES 230524 C 94', 0.17, 0.00, 0, 'pending', 'farazmatin', 'signalchannel', 3, '2024-05-23 04:33:23', '1100830612383879188', '403285053259513858', '', 0, 0, '', NULL, NULL),
(295, '05/23/2024 00:33:23', NULL, 'StockOptions', '', 1, 'open', 'AMD_AMDS 230524 C 175', 1.30, 0.00, 0, 'pending', 'farazmatin', 'signalchannel', 5, '2024-05-23 04:33:24', '1100830612383879188', '403285053259513858', '', 0, 0, '', NULL, NULL),
(296, '05/23/2024 00:33:23', NULL, 'StockOptions', '', -1, 'close', 'CRWD_CRWDS 230524 C 360', 0.82, 0.00, 0, 'pending', 'farazmatin', 'signalchannel', 2, '2024-05-23 04:33:24', '1100830612383879188', '403285053259513858', '', 0, 0, '', NULL, NULL),
(297, '05/23/2024 00:33:23', NULL, 'Futures', 'ES', 1, 'open', 'ES JUN24', 123456.00, 5361.25, 0, 'skipped - price out of range', 'farazmatin', 'signalchannel', 3, '2024-05-23 04:33:24', '1100830612383879188', '403285053259513858', '', 0, 0, '', NULL, NULL),
(298, '05/23/2024 00:33:23', NULL, 'Futures', 'ES', 1, 'close', 'ES JUN24', 16000.00, 5361.25, 0, 'skipped - no short position to close', 'farazmatin', 'signalchannel', 3, '2024-05-23 04:33:24', '1100830612383879188', '403285053259513858', '', 0, 0, '', NULL, NULL),
(299, '05/23/2024 00:33:23', NULL, 'Stocks-Forex', '', 1, 'open', 'MES', 5333.25, 0.00, 0, 'pending', 'farazmatin', 'signalchannel', 5, '2024-05-23 04:33:24', '1100830612383879188', '403285053259513858', '', 0, 0, '', NULL, NULL),
(300, '05/23/2024 00:33:23', NULL, 'Stocks-Forex', '', 1, 'open', 'MES', 5333.25, 0.00, 0, 'pending', 'farazmatin', 'signalchannel', 5, '2024-05-23 04:33:24', '1100830612383879188', '403285053259513858', '', 0, 0, '', NULL, NULL),
(301, '05/23/2024 00:33:24', NULL, 'StockOptions', '', -1, 'close', 'XOM_XOMS 230524 C 117', 0.44, 0.00, 0, 'pending', 'farazmatin', 'signalchannel', 50, '2024-05-23 04:33:24', '1100830612383879188', '403285053259513858', '', 0, 0, '', NULL, NULL),
(302, '05/23/2024 00:33:24', NULL, 'StockOptions', '', -1, 'close', 'NKE_NKES 230524 C 94', 0.17, 0.00, 0, 'pending', 'farazmatin', 'signalchannel', 3, '2024-05-23 04:33:24', '1100830612383879188', '403285053259513858', '', 0, 0, '', NULL, NULL),
(303, '05/23/2024 00:33:24', NULL, 'StockOptions', '', 1, 'open', 'AMD_AMDS 230524 C 175', 1.30, 0.00, 0, 'pending', 'farazmatin', 'signalchannel', 5, '2024-05-23 04:33:24', '1100830612383879188', '403285053259513858', '', 0, 0, '', NULL, NULL),
(304, '05/23/2024 00:33:24', NULL, 'StockOptions', '', -1, 'close', 'CRWD_CRWDS 230524 C 360', 0.82, 0.00, 0, 'pending', 'farazmatin', 'signalchannel', 2, '2024-05-23 04:33:24', '1100830612383879188', '403285053259513858', '', 0, 0, '', NULL, NULL),
(305, '05/23/2024 00:33:24', NULL, 'Futures', 'ES', 1, 'open', 'ES JUN24', 123456.00, 5361.25, 0, 'skipped - price out of range', 'farazmatin', 'signalchannel', 3, '2024-05-23 04:33:24', '1100830612383879188', '403285053259513858', '', 0, 0, '', NULL, NULL),
(306, '05/23/2024 00:33:24', NULL, 'Futures', 'ES', 1, 'close', 'ES JUN24', 16000.00, 5361.25, 0, 'skipped - no short position to close', 'farazmatin', 'signalchannel', 3, '2024-05-23 04:33:24', '1100830612383879188', '403285053259513858', '', 0, 0, '', NULL, NULL),
(307, '05/23/2024 00:33:24', NULL, 'Stocks-Forex', '', 1, 'open', 'MES', 5333.25, 0.00, 0, 'pending', 'farazmatin', 'signalchannel', 5, '2024-05-23 04:33:24', '1100830612383879188', '403285053259513858', '', 0, 0, '', NULL, NULL),
(308, '05/23/2024 00:33:24', NULL, 'Stocks-Forex', '', 1, 'open', 'MES', 5333.25, 0.00, 0, 'pending', 'farazmatin', 'signalchannel', 5, '2024-05-23 04:33:24', '1100830612383879188', '403285053259513858', '', 0, 0, '', NULL, NULL),
(309, '05/23/2024 00:33:24', NULL, 'StockOptions', '', -1, 'close', 'XOM_XOMS 230524 C 117', 0.44, 0.00, 0, 'pending', 'farazmatin', 'signalchannel', 50, '2024-05-23 04:33:24', '1100830612383879188', '403285053259513858', '', 0, 0, '', NULL, NULL),
(310, '05/23/2024 00:33:24', NULL, 'StockOptions', '', -1, 'close', 'NKE_NKES 230524 C 94', 0.17, 0.00, 0, 'pending', 'farazmatin', 'signalchannel', 3, '2024-05-23 04:33:24', '1100830612383879188', '403285053259513858', '', 0, 0, '', NULL, NULL),
(311, '05/23/2024 00:33:24', NULL, 'StockOptions', '', 1, 'open', 'AMD_AMDS 230524 C 175', 1.30, 0.00, 0, 'pending', 'farazmatin', 'signalchannel', 5, '2024-05-23 04:33:24', '1100830612383879188', '403285053259513858', '', 0, 0, '', NULL, NULL),
(312, '05/23/2024 00:33:24', NULL, 'StockOptions', '', -1, 'close', 'CRWD_CRWDS 230524 C 360', 0.82, 0.00, 0, 'pending', 'farazmatin', 'signalchannel', 2, '2024-05-23 04:33:24', '1100830612383879188', '403285053259513858', '', 0, 0, '', NULL, NULL),
(313, '05/23/2024 00:33:24', NULL, 'Futures', 'ES', 1, 'close', 'ES JUN24', 16000.00, 5361.50, 0, 'skipped - no short position to close', 'farazmatin', 'signalchannel', 3, '2024-05-23 04:33:24', '1100830612383879188', '403285053259513858', '', 0, 0, '', NULL, NULL),
(314, '05/23/2024 00:33:24', NULL, 'Stocks-Forex', '', 1, 'open', 'MES', 5333.25, 0.00, 0, 'pending', 'farazmatin', 'signalchannel', 5, '2024-05-23 04:33:24', '1100830612383879188', '403285053259513858', '', 0, 0, '', NULL, NULL),
(315, '05/23/2024 00:33:24', NULL, 'Stocks-Forex', '', 1, 'open', 'MES', 5333.25, 0.00, 0, 'pending', 'farazmatin', 'signalchannel', 5, '2024-05-23 04:33:24', '1100830612383879188', '403285053259513858', '', 0, 0, '', NULL, NULL),
(316, '05/23/2024 00:33:25', NULL, 'Futures', 'ES', -1, 'close', 'ES JUN24', 99999999.99, 5361.50, 0, 'skipped - no long position to close', 'farazmatin', 'signalchannel', 3, '2024-05-23 04:33:25', '1100830612383879188', '403285053259513858', '', 0, 0, '', NULL, NULL),
(317, '05/23/2024 08:56:03', NULL, 'Stocks-Forex', '', 0, 'Null', 'ES', 5366.00, 0.00, 0, 'pending', 'turnerdan94', 'ðŸš€ï¸±member-alerts', 0, '2024-05-23 12:56:03', '1232475511150743632', '907996064630587432', '', 0, 0, '', NULL, NULL),
(318, '05/23/2024 09:35:57', '05/23/2024 09:35:57', 'Futures', 'ES', 1, 'open', 'ES JUN24', 5347.25, 5348.00, 5348, 'Enter Long Filled', 'dcruz', 'ðŸ’«ï¸±futures-alerts', 0, '2024-05-23 13:35:57', '1232475403407327303', '480583337661038602', '', 1, 0, '', NULL, NULL),
(319, '05/23/2024 09:37:35', NULL, 'Futures', 'ES', -1, 'close', 'ES JUN24', 5344.25, 5344.75, 0, 'skipped - no long position to close', 'dcruz', 'ðŸ’«ï¸±futures-alerts', 0, '2024-05-23 13:37:35', '1232475403407327303', '480583337661038602', '', 0, 0, '', NULL, NULL),
(320, '05/23/2024 09:38:45', '05/23/2024 09:38:45', 'Futures', 'ES', 1, 'open', 'ES JUN24', 5346.00, 5346.75, 5346.75, 'Enter Long Filled', 'ocean212', 'ðŸ’«ï¸±futures-alerts', 1, '2024-05-23 13:38:45', '1232475403407327303', '180421030605488128', '', 1, 0, '', NULL, NULL),
(321, '05/23/2024 09:41:20', NULL, 'Futures', 'ES', -1, 'close', 'ES JUN24', 5342.00, 5342.50, 0, 'skipped - no long position to close', 'ocean212', 'ðŸ’«ï¸±futures-alerts', 1, '2024-05-23 13:41:20', '1232475403407327303', '180421030605488128', '', 0, 0, '', NULL, NULL),
(322, '05/23/2024 09:41:26', NULL, 'Stocks-Forex', '', 1, 'open', 'MNQ', 18914.75, 0.00, 0, 'pending', 'presten.7', 'ðŸ’«ï¸±futures-alerts', 3, '2024-05-23 13:41:26', '1232475403407327303', '820065977584451636', '', 0, 0, '', NULL, NULL),
(323, '05/23/2024 09:41:59', NULL, 'Futures', 'NQ', -1, 'close', 'NQ JUN24', 18930.00, 18919.75, 0, 'skipped - no long position to close', 'srostrades', 'ðŸ’«ï¸±futures-alerts', 10, '2024-05-23 13:41:59', '1232475403407327303', '500695745339588618', '', 0, 0, '', NULL, NULL),
(324, '05/23/2024 09:44:36', NULL, 'Stocks-Forex', '', -1, 'close', 'MNQ', 18930.75, 0.00, 0, 'pending', 'presten.7', 'ðŸ’«ï¸±futures-alerts', 3, '2024-05-23 13:44:36', '1232475403407327303', '820065977584451636', '', 0, 0, '', NULL, NULL),
(325, '05/23/2024 09:47:13', NULL, 'StockOptions', '', 1, 'open', 'SPY_SPYS 230523 C 532', 0.94, 0.00, 0, 'pending', 'dcruz', 'ðŸ’Žï¸±options-stock-alerts', 10, '2024-05-23 13:47:13', '1232475648396759132', '480583337661038602', '', 0, 0, '', NULL, NULL),
(326, '05/23/2024 09:49:57', '05/23/2024 09:49:57', 'Futures', 'ES', 1, 'open', 'ES JUN24', 5335.75, 5337.00, 5337, 'Enter Long Filled', 'ocean212', 'ðŸ’«ï¸±futures-alerts', 1, '2024-05-23 13:49:57', '1232475403407327303', '180421030605488128', '', 1, 0, '', NULL, NULL),
(327, '05/23/2024 09:51:25', NULL, 'Futures', 'ES', -1, 'close', 'ES JUN24', 5331.75, 5330.00, 0, 'skipped - no long position to close', 'ocean212', 'ðŸ’«ï¸±futures-alerts', 1, '2024-05-23 13:51:25', '1232475403407327303', '180421030605488128', '', 0, 0, '', NULL, NULL),
(328, '05/23/2024 09:54:47', NULL, 'StockOptions', '', -1, 'close', 'SPY_SPYS 230523 C 532', 0.55, 0.00, 0, 'pending', 'dcruz', 'ðŸ’Žï¸±options-stock-alerts', 10, '2024-05-23 13:54:47', '1232475648396759132', '480583337661038602', '', 0, 0, '', NULL, NULL),
(329, '05/23/2024 09:57:58', NULL, 'Futures', 'NQ', 1, 'open', 'NQ JUN24', 18844.00, 18855.75, 0, 'skipped - price out of range', 'srostrades', 'ðŸ’«ï¸±futures-alerts', 10, '2024-05-23 13:57:58', '1232475403407327303', '500695745339588618', '', 0, 0, '', NULL, NULL),
(330, '05/23/2024 10:02:09', NULL, 'Futures', 'NQ', -1, 'close', 'NQ JUN24', 18873.00, 18866.75, 0, 'skipped - no long position to close', 'srostrades', 'ðŸ’«ï¸±futures-alerts', 7, '2024-05-23 14:02:09', '1232475403407327303', '500695745339588618', '', 0, 0, '', NULL, NULL),
(331, '05/23/2024 10:08:21', NULL, 'StockOptions', '', 1, 'open', 'MSFT_MSFTS 230524 P 427.5', 0.82, 0.00, 0, 'pending', 'dcruz', 'ðŸ’Žï¸±options-stock-alerts', 12, '2024-05-23 14:08:21', '1232475648396759132', '480583337661038602', '', 0, 0, '', NULL, NULL),
(332, '05/23/2024 10:08:55', '05/23/2024 10:08:55', 'Futures', 'ES', 1, 'open', 'ES JUN24', 5327.50, 5328.75, 5328.75, 'Enter Long Filled', 'ocean212', 'ðŸ’«ï¸±futures-alerts', 1, '2024-05-23 14:08:55', '1232475403407327303', '180421030605488128', '', 1, 0, '', NULL, NULL),
(333, '05/23/2024 10:09:19', NULL, 'StockOptions', '', 1, 'open', 'META_METAS 230524 C 470', 2.66, 0.00, 0, 'pending', 'bcf', 'ðŸ’Žï¸±options-stock-alerts', 10, '2024-05-23 14:09:19', '1232475648396759132', '526074289640833025', '', 0, 0, '', NULL, NULL),
(334, '05/23/2024 10:09:45', NULL, 'Futures', 'ES', -1, 'close', 'ES JUN24', 5330.25, 5329.00, 0, 'skipped - Mismatched provider', 'dcruz', 'ðŸ’«ï¸±futures-alerts', 0, '2024-05-23 14:09:45', '1232475403407327303', '480583337661038602', '', 0, 0, '', NULL, NULL),
(335, '05/23/2024 10:10:42', NULL, 'Futures', 'ES', 1, 'close', 'ES JUN24', 5333.25, 5334.25, 0, 'skipped - no short position to close', 'dcruz', 'ðŸ’«ï¸±futures-alerts', 0, '2024-05-23 14:10:42', '1232475403407327303', '480583337661038602', '', 0, 0, '', NULL, NULL),
(336, '05/23/2024 10:10:53', NULL, 'Futures', 'NQ', -1, 'close', 'NQ JUN24', 18890.00, 18897.75, 0, 'skipped - no long position to close', 'srostrades', 'ðŸ’«ï¸±futures-alerts', 3, '2024-05-23 14:10:53', '1232475403407327303', '500695745339588618', '', 0, 0, '', NULL, NULL),
(337, '05/23/2024 10:11:05', NULL, 'Futures', 'ES', -1, 'close', 'ES JUN24', 5334.25, 5334.75, 0, 'skipped - no long position to close', 'ocean212', 'ðŸ’«ï¸±futures-alerts', 1, '2024-05-23 14:11:05', '1232475403407327303', '180421030605488128', '', 0, 0, '', NULL, NULL),
(338, '05/23/2024 10:15:36', NULL, 'Futures', 'ES', 1, 'open', 'ES JUN24', 5334.00, 0.00, 0, 'expired - time', 'jw2014', 'ðŸ’«ï¸±futures-alerts', 1, '2024-05-23 14:15:36', '1232475403407327303', '625952281040257034', '', 0, 0, '', NULL, NULL),
(339, '05/23/2024 10:16:29', NULL, 'StockOptions', '', 1, 'open', 'COIN_COINS 230719 C 350', 4.40, 0.00, 0, 'pending', 'evapanda', 'ðŸ’Žï¸±options-stock-alerts', 3, '2024-05-23 14:16:29', '1232475648396759132', '536430344489009153', '', 0, 0, '', NULL, NULL),
(340, '05/23/2024 10:18:41', NULL, 'Futures', 'ES', -1, 'close', 'ES JUN24', 5331.00, 0.00, 0, 'expired - time', 'jw2014', 'ðŸ’«ï¸±futures-alerts', 1, '2024-05-23 14:18:41', '1232475403407327303', '625952281040257034', '', 0, 0, '', NULL, NULL),
(341, '05/23/2024 11:59:32', NULL, 'StockOptions', '', 1, 'open', 'LMND_LMNDS 230117 C 10', 6.90, 0.00, 0, 'pending', 'skowih', 'ðŸ’Žï¸±options-stock-alerts', 8, '2024-05-23 15:59:32', '1232475648396759132', '334147594039328790', '', 0, 0, '', NULL, NULL),
(342, '05/23/2024 12:28:54', NULL, 'StockOptions', '', -1, 'close', 'MSFT_MSFTS 230424 P 427.5', 0.46, 0.00, 0, 'pending', 'dcruz', 'ðŸ’Žï¸±options-stock-alerts', 12, '2024-05-23 16:28:54', '1232475648396759132', '480583337661038602', '', 0, 0, '', NULL, NULL),
(343, '05/23/2024 12:48:13', NULL, 'StockOptions', '', 1, 'open', 'GME_GMES 230524 C 20.5', 1.07, 0.00, 0, 'pending', 'bcf', 'ðŸ’Žï¸±options-stock-alerts', 10, '2024-05-23 16:48:13', '1232475648396759132', '526074289640833025', '', 0, 0, '', NULL, NULL),
(344, '05/23/2024 13:10:51', NULL, 'StockOptions', '', 1, 'open', 'MSFT_MSFTS 230524 P 427.5', 0.85, 0.00, 0, 'pending', 'dcruz', 'ðŸ’Žï¸±options-stock-alerts', 15, '2024-05-23 17:10:51', '1232475648396759132', '480583337661038602', '', 0, 0, '', NULL, NULL),
(345, '05/23/2024 13:20:49', NULL, 'StockOptions', '', -1, 'close', 'GME_GMES 230524 C 20.5', 1.01, 0.00, 0, 'pending', 'bcf', 'ðŸ’Žï¸±options-stock-alerts', 10, '2024-05-23 17:20:49', '1232475648396759132', '526074289640833025', '', 0, 0, '', NULL, NULL),
(346, '05/23/2024 13:35:00', NULL, 'StockOptions', '', 1, 'open', 'MSFT_MSFTS 230607 P 420', 1.97, 0.00, 0, 'pending', 'dcruz', 'ðŸ’Žï¸±options-stock-alerts', 5, '2024-05-23 17:35:00', '1232475648396759132', '480583337661038602', '', 0, 0, '', NULL, NULL),
(347, '05/23/2024 13:38:35', NULL, 'StockOptions', '', -1, 'close', 'MSFT_MSFTS 230524 P 427', 1.46, 0.00, 0, 'pending', 'dcruz', 'ðŸ’Žï¸±options-stock-alerts', 15, '2024-05-23 17:38:35', '1232475648396759132', '480583337661038602', '', 0, 0, '', NULL, NULL),
(348, '05/23/2024 13:39:04', NULL, 'StockOptions', '', -1, 'close', 'MSFT_MSFTS 230524 P 427.5', 1.46, 0.00, 0, 'pending', 'dcruz', 'ðŸ’Žï¸±options-stock-alerts', 15, '2024-05-23 17:39:04', '1232475648396759132', '480583337661038602', '', 0, 0, '', NULL, NULL),
(349, '05/23/2024 13:45:39', NULL, 'StockOptions', '', 1, 'open', 'QQQ_QQQS 230524 C 460', 0.31, 0.00, 0, 'pending', 'bendc2r', 'ðŸ’Žï¸±options-stock-alerts', 5, '2024-05-23 17:45:39', '1232475648396759132', '426126942505402371', '', 0, 0, '', NULL, NULL),
(350, '05/23/2024 14:00:14', NULL, 'Futures', 'GC', 1, 'open', 'GC JUN24', 2333.60, 0.00, 0, 'pending', 'trav_trades', 'ðŸ’«ï¸±futures-alerts', 3, '2024-05-23 18:00:14', '1232475403407327303', '399929170928467968', '', 0, 0, '', NULL, NULL),
(351, '05/23/2024 14:00:18', NULL, 'StockOptions', '', -1, 'close', 'QQQ_QQQS 230524 C 460', 0.21, 0.00, 0, 'pending', 'bendc2r', 'ðŸ’Žï¸±options-stock-alerts', 5, '2024-05-23 18:00:18', '1232475648396759132', '426126942505402371', '', 0, 0, '', NULL, NULL),
(352, '05/23/2024 14:01:18', NULL, 'StockOptions', '', -1, 'close', 'MSFT_MSFTS 230607 P 420', 2.62, 0.00, 0, 'pending', 'dcruz', 'ðŸ’Žï¸±options-stock-alerts', 3, '2024-05-23 18:01:18', '1232475648396759132', '480583337661038602', '', 0, 0, '', NULL, NULL),
(353, '05/23/2024 14:05:59', NULL, 'StockOptions', '', -1, 'close', 'CRWD_CRWDS 230524 C 360', 0.82, 0.00, 0, 'pending', 'farazmatin', 'signalchannel', 2, '2024-05-23 18:05:59', '1100830612383879188', '403285053259513858', '', 0, 0, '', NULL, NULL),
(354, '05/23/2024 14:05:59', NULL, 'Futures', 'ES', 1, 'close', 'ES JUN24', 16000.00, 5287.50, 0, 'skipped - no short position to close', 'farazmatin', 'signalchannel', 3, '2024-05-23 18:05:59', '1100830612383879188', '403285053259513858', '', 0, 0, '', NULL, NULL),
(355, '05/23/2024 14:05:59', NULL, 'Futures', 'ES', -1, 'close', 'ES JUN24', 99999999.99, 5287.50, 0, 'skipped - no long position to close', 'farazmatin', 'signalchannel', 3, '2024-05-23 18:05:59', '1100830612383879188', '403285053259513858', '', 0, 0, '', NULL, NULL),
(356, '05/23/2024 14:05:59', NULL, 'Stocks-Forex', '', 1, 'open', 'MES', 5333.25, 0.00, 0, 'pending', 'farazmatin', 'signalchannel', 5, '2024-05-23 18:05:59', '1100830612383879188', '403285053259513858', '', 0, 0, '', NULL, NULL),
(357, '05/23/2024 14:05:59', NULL, 'Stocks-Forex', '', 1, 'open', 'MES', 5333.25, 0.00, 0, 'pending', 'farazmatin', 'signalchannel', 5, '2024-05-23 18:05:59', '1100830612383879188', '403285053259513858', '', 0, 0, '', NULL, NULL),
(358, '05/23/2024 14:07:05', NULL, 'Futures', 'GC', 1, 'open', 'GC JUN24', 2333.60, 0.00, 0, 'pending', 'farazmatin', 'signalchannel', 3, '2024-05-23 18:07:05', '1100830612383879188', '403285053259513858', '', 0, 0, '', NULL, NULL),
(359, '05/23/2024 14:09:26', NULL, 'Futures', 'GC', -1, 'close', 'GC JUN24', 2335.70, 0.00, 0, 'pending', 'trav_trades', 'ðŸ’«ï¸±futures-alerts', 3, '2024-05-23 18:09:26', '1232475403407327303', '399929170928467968', '', 0, 0, '', NULL, NULL),
(360, '05/23/2024 14:54:48', NULL, 'StockOptions', '', -1, 'close', 'MSFT_MSFTS 230607 P 420', 3.15, 0.00, 0, 'pending', 'dcruz', 'ðŸ’Žï¸±options-stock-alerts', 1, '2024-05-23 18:54:48', '1232475648396759132', '480583337661038602', '', 0, 0, '', NULL, NULL),
(361, '05/23/2024 16:58:03', '05/23/2024 16:58:04', 'Futures', 'ES', 1, 'open', 'ES JUN24', 5286.00, 5286.50, 5286.5, 'Enter Long Filled', 'farazmatin', 'signalchannel', 3, '2024-05-23 20:58:03', '1100830612383879188', '403285053259513858', '', 3, 0, '', NULL, NULL),
(362, '05/23/2024 16:58:40', NULL, 'Futures', 'ES', -1, 'close', 'ES JUN24', 5286.00, 5286.50, 0, 'Exit Long Placed', 'farazmatin', 'signalchannel', 3, '2024-05-23 20:58:40', '1100830612383879188', '403285053259513858', '', 0, 0, '', NULL, NULL),
(363, '05/23/2024 16:59:00', '05/23/2024 16:59:00', 'Futures', 'ES', 1, 'open', 'ES JUN24', 5286.00, 5286.50, 5286.5, 'Enter Long Filled', 'farazmatin', 'signalchannel', 3, '2024-05-23 20:59:00', '1100830612383879188', '403285053259513858', '', 3, 0, '', NULL, NULL),
(364, '05/23/2024 17:01:41', NULL, 'Futures', 'ES', 1, 'open', 'ES JUN24', 5286.00, 5361.25, 0, 'skipped - price out of range', 'farazmatin', 'signalchannel', 3, '2024-05-23 21:01:41', '1100830612383879188', '403285053259513858', '', 0, 0, '', NULL, NULL),
(365, '05/23/2024 17:03:11', NULL, 'Futures', 'ES', 1, 'open', 'ES JUN24', 5286.00, 0.00, 0, 'expired - time', 'farazmatin', 'signalchannel', 3, '2024-05-23 21:03:11', '1100830612383879188', '403285053259513858', '', 0, 0, '', NULL, NULL),
(366, '05/24/2024 08:47:35', NULL, 'Stocks-Forex', '', -1, 'close', 'MNQ', 18754.25, 0.00, 0, 'pending', 'presten.7', 'ðŸ’«ï¸±futures-alerts', 3, '2024-05-24 12:47:35', '1232475403407327303', '820065977584451636', '', 0, 0, '', NULL, NULL),
(367, '05/24/2024 09:04:42', '05/24/2024 09:04:42', 'Futures', 'ES', 1, 'open', 'ES JUN24', 5302.00, 5302.25, 5302.25, 'Enter Long Filled', 'steveo21', 'ðŸš€ï¸±member-alerts', 0, '2024-05-24 13:04:42', '1232475511150743632', '493829082924974103', '', 1, 0, '', NULL, NULL),
(368, '05/24/2024 13:25:32', NULL, 'Stocks-Forex', '', 0, 'Null', 'MNQ', 18898.00, 0.00, 0, 'pending', 'presten.7', 'ðŸ’«ï¸±futures-alerts', 3, '2024-05-24 17:25:32', '1232475403407327303', '820065977584451636', '', 0, 0, '', NULL, NULL),
(369, '05/24/2024 14:52:39', NULL, 'Stocks-Forex', '', 1, 'open', 'IP', 45.51, 0.00, 0, 'pending', 'jw2014', 'ðŸ’Žï¸±options-stock-alerts', 50, '2024-05-24 18:52:39', '1232475648396759132', '625952281040257034', '', 0, 0, '', NULL, NULL),
(370, '05/24/2024 15:37:57', NULL, 'StockOptions', '', 1, 'open', 'DD_DDS 231018  ', 2.85, 0.00, 0, 'pending', 'jw2014', 'ðŸ’Žï¸±options-stock-alerts', 2, '2024-05-24 19:37:57', '1232475648396759132', '625952281040257034', '', 0, 0, '', NULL, NULL),
(371, '05/24/2024 15:45:43', NULL, 'Stocks-Forex', '', 1, 'open', 'IP', 45.51, 0.00, 0, 'pending', 'jw2014', 'ðŸ’Žï¸±options-stock-alerts', 50, '2024-05-24 19:45:43', '1232475648396759132', '625952281040257034', '', 0, 0, '', NULL, NULL),
(372, '05/24/2024 15:45:55', NULL, 'StockOptions', '', 1, 'open', 'DD_DDS 231018 C 85', 2.85, 0.00, 0, 'pending', 'jw2014', 'ðŸ’Žï¸±options-stock-alerts', 2, '2024-05-24 19:45:55', '1232475648396759132', '625952281040257034', '', 0, 0, '', NULL, NULL);

--
-- Triggers `signals`
--
DELIMITER $$
CREATE TRIGGER `UpdateUserProv` AFTER INSERT ON `signals` FOR EACH ROW INSERT INTO userprovider (Channel_id, Provider_id, AssetType, InstrumentType, ProviderName, ChannelName, StopLossPercent, PositionSizePercent, TrailPercent, BreakEvenPercent, TP1Percent, EntryOffsetPercent)
select distinct  temp.Channel_id, temp.Provider_id, temp.AssetType, temp.InstrumentType, temp.ProviderName, temp.ChannelName, 0.06634, 5, 0.022, 0.11057, 0.13057, 0.022 from (
select signals.* from signals left join userprovider on signals.Channel_id=userprovider.Channel_id and signals.Provider_id=userprovider.Provider_id and signals.AssetType=userprovider.AssetType and signals.InstrumentType=userprovider.InstrumentType
where userprovider.Channel_id is null and userprovider.Provider_id is null and userprovider.AssetType is null and userprovider.InstrumentType is null
)temp
$$
DELIMITER ;

-- --------------------------------------------------------

--
-- Table structure for table `subscription`
--

CREATE TABLE `subscription` (
  `id` int(11) NOT NULL,
  `user_id` int(11) NOT NULL,
  `UserKey` varchar(40) NOT NULL,
  `stocks` bit(1) DEFAULT NULL,
  `forex` bit(1) DEFAULT NULL,
  `options` bit(1) DEFAULT NULL,
  `crypto` bit(1) DEFAULT NULL
) ENGINE=InnoDB DEFAULT CHARSET=utf8mb4 COLLATE=utf8mb4_general_ci;

-- --------------------------------------------------------

--
-- Table structure for table `tradeexecution`
--

CREATE TABLE `tradeexecution` (
  `id` int(11) NOT NULL,
  `ChannelName` varchar(45) DEFAULT NULL,
  `ProviderName` varchar(45) DEFAULT NULL,
  `CreationTime` timestamp NULL DEFAULT NULL,
  `ExecutionTime` timestamp NULL DEFAULT NULL,
  `Quantity` int(11) DEFAULT NULL,
  `Instrument` varchar(255) DEFAULT NULL,
  `EntryPrice` float DEFAULT NULL,
  `ExitPrice` float DEFAULT NULL,
  `PnL_amount` float DEFAULT NULL,
  `Pnl_perc` float DEFAULT NULL
) ENGINE=InnoDB DEFAULT CHARSET=utf8mb4 COLLATE=utf8mb4_general_ci;

--
-- Dumping data for table `tradeexecution`
--

